[I 2026-06-21 18:34:36,986] Trial 24 finished with value: 0.33684507218136595 and parameters: {'k_features': 89, 'n_estimators': 703, 'max_depth': 22, 'min_samples_split': 17, 'min_samples_leaf': 16, 'max_features': 0.44774047659229427}. Best is trial 13 with value: 0.3363638140844673.
[I 2026-06-21 18:34:41,630] Trial 25 finished with value: 0.33712039568886604 and parameters: {'k_features': 90, 'n_estimators': 700, 'max_depth': 17, 'min_samples_split': 17, 'min_samples_leaf': 14, 'max_features': 0.529465359492866}. Best is trial 13 with value: 0.3363638140844673.
[I 2026-06-21 18:34:45,676] Trial 26 finished with value: 0.33693905018701953 and parameters: {'k_features': 87, 'n_estimators': 614, 'max_depth': 21, 'min_samples_split': 10, 'min_samples_leaf': 18, 'max_features': 0.5046460980899419}. Best is trial 13 with value: 0.3363638140844673.
[I 2026-06-21 18:34:50,831] Trial 27 finished with value: 0.3374560408259322 and parameters: {'k_features': 70, 'n_estimators': 722, 'max_depth': 27, 'min_samples_split': 16, 'min_samples_leaf': 8, 'max_features': 0.5679953289843596}. Best is trial 13 with value: 0.3363638140844673.
[I 2026-06-21 18:34:53,686] Trial 28 finished with value: 0.3368843066985673 and parameters: {'k_features': 80, 'n_estimators': 418, 'max_depth': 17, 'min_samples_split': 11, 'min_samples_leaf': 11, 'max_features': 0.4393624720620493}. Best is trial 13 with value: 0.3363638140844673.
[I 2026-06-21 18:34:57,350] Trial 29 finished with value: 0.3369631716592033 and parameters: {'k_features': 92, 'n_estimators': 523, 'max_depth': 23, 'min_samples_split': 20, 'min_samples_leaf': 12, 'max_features': 0.5332628336046016}. Best is trial 13 with value: 0.3363638140844673.
[I 2026-06-21 18:35:01,019] Trial 30 finished with value: 0.33689849971444186 and parameters: {'k_features': 64, 'n_estimators': 550, 'max_depth': 22, 'min_samples_split': 19, 'min_samples_leaf': 15, 'max_features': 0.4875099858541938}. Best is trial 13 with value: 0.3363638140844673.
[I 2026-06-21 18:35:05,772] Trial 31 finished with value: 0.3368484908373634 and parameters: {'k_features': 48, 'n_estimators': 748, 'max_depth': 25, 'min_samples_split': 23, 'min_samples_leaf': 16, 'max_features': 0.4404387629667669}. Best is trial 13 with value: 0.3363638140844673.
[I 2026-06-21 18:35:09,911] Trial 32 finished with value: 0.3369852559767511 and parameters: {'k_features': 33, 'n_estimators': 647, 'max_depth': 25, 'min_samples_split': 22, 'min_samples_leaf': 17, 'max_features': 0.4370638770602559}. Best is trial 13 with value: 0.3363638140844673.
[I 2026-06-21 18:35:14,813] Trial 33 finished with value: 0.33695050142162225 and parameters: {'k_features': 76, 'n_estimators': 745, 'max_depth': 22, 'min_samples_split': 15, 'min_samples_leaf': 19, 'max_features': 0.4088000249329342}. Best is trial 13 with value: 0.3363638140844673.
[I 2026-06-21 18:35:19,581] Trial 34 finished with value: 0.33665816436551654 and parameters: {'k_features': 50, 'n_estimators': 743, 'max_depth': 19, 'min_samples_split': 28, 'min_samples_leaf': 16, 'max_features': 0.46984036141692914}. Best is trial 13 with value: 0.3363638140844673.
[I 2026-06-21 18:35:24,122] Trial 35 finished with value: 0.33727134924442176 and parameters: {'k_features': 62, 'n_estimators': 695, 'max_depth': 18, 'min_samples_split': 27, 'min_samples_leaf': 13, 'max_features': 0.5336401330746035}. Best is trial 13 with value: 0.3363638140844673.
[I 2026-06-21 18:35:28,228] Trial 36 finished with value: 0.3365497420757511 and parameters: {'k_features': 83, 'n_estimators': 646, 'max_depth': 13, 'min_samples_split': 27, 'min_samples_leaf': 18, 'max_features': 0.489205559772406}. Best is trial 13 with value: 0.3363638140844673.
[I 2026-06-21 18:35:32,313] Trial 37 finished with value: 0.33750440151395866 and parameters: {'k_features': 71, 'n_estimators': 610, 'max_depth': 12, 'min_samples_split': 28, 'min_samples_leaf': 19, 'max_features': 0.6022239214651604}. Best is trial 13 with value: 0.3363638140844673.
[I 2026-06-21 18:35:36,587] Trial 38 finished with value: 0.3365375608502156 and parameters: {'k_features': 83, 'n_estimators': 666, 'max_depth': 13, 'min_samples_split': 30, 'min_samples_leaf': 18, 'max_features': 0.48966416680469527}. Best is trial 13 with value: 0.3363638140844673.
[I 2026-06-21 18:35:40,605] Trial 39 finished with value: 0.33714545937726526 and parameters: {'k_features': 81, 'n_estimators': 574, 'max_depth': 9, 'min_samples_split': 30, 'min_samples_leaf': 18, 'max_features': 0.625770628218923}. Best is trial 13 with value: 0.3363638140844673.
[I 2026-06-21 18:35:45,384] Trial 40 finished with value: 0.3386709433014624 and parameters: {'k_features': 84, 'n_estimators': 653, 'max_depth': 13, 'min_samples_split': 26, 'min_samples_leaf': 4, 'max_features': 0.6690472428522464}. Best is trial 13 with value: 0.3363638140844673.
[I 2026-06-21 18:35:49,732] Trial 41 finished with value: 0.33685277486321286 and parameters: {'k_features': 57, 'n_estimators': 677, 'max_depth': 11, 'min_samples_split': 28, 'min_samples_leaf': 19, 'max_features': 0.49192391347465303}. Best is trial 13 with value: 0.3363638140844673.
[I 2026-06-21 18:35:54,459] Trial 42 finished with value: 0.3367587462346945 and parameters: {'k_features': 75, 'n_estimators': 764, 'max_depth': 14, 'min_samples_split': 29, 'min_samples_leaf': 17, 'max_features': 0.4736866529000722}. Best is trial 13 with value: 0.3363638140844673.
[I 2026-06-21 18:35:55,921] Trial 43 finished with value: 0.336946346963982 and parameters: {'k_features': 34, 'n_estimators': 164, 'max_depth': 7, 'min_samples_split': 6, 'min_samples_leaf': 18, 'max_features': 0.550402859950662}. Best is trial 13 with value: 0.3363638140844673.
[I 2026-06-21 18:35:58,653] Trial 44 finished with value: 0.33793338094144704 and parameters: {'k_features': 100, 'n_estimators': 352, 'max_depth': 15, 'min_samples_split': 30, 'min_samples_leaf': 7, 'max_features': 0.5119130183770415}. Best is trial 13 with value: 0.3363638140844673.
[I 2026-06-21 18:36:02,095] Trial 45 finished with value: 0.3371385478548694 and parameters: {'k_features': 93, 'n_estimators': 497, 'max_depth': 19, 'min_samples_split': 27, 'min_samples_leaf': 15, 'max_features': 0.5846099829777532}. Best is trial 13 with value: 0.3363638140844673.
[I 2026-06-21 18:36:05,083] Trial 46 finished with value: 0.33682217316377744 and parameters: {'k_features': 27, 'n_estimators': 436, 'max_depth': 16, 'min_samples_split': 28, 'min_samples_leaf': 13, 'max_features': 0.47612936265194034}. Best is trial 13 with value: 0.3363638140844673.
[I 2026-06-21 18:36:10,100] Trial 47 finished with value: 0.3378073915695503 and parameters: {'k_features': 65, 'n_estimators': 632, 'max_depth': 10, 'min_samples_split': 26, 'min_samples_leaf': 17, 'max_features': 0.9851406073301351}. Best is trial 13 with value: 0.3363638140844673.
[I 2026-06-21 18:36:14,043] Trial 48 finished with value: 0.3405924209124002 and parameters: {'k_features': 51, 'n_estimators': 722, 'max_depth': 3, 'min_samples_split': 4, 'min_samples_leaf': 15, 'max_features': 0.4209242317214972}. Best is trial 13 with value: 0.3363638140844673.
[I 2026-06-21 18:36:16,134] Trial 49 finished with value: 0.3371296094667199 and parameters: {'k_features': 95, 'n_estimators': 291, 'max_depth': 15, 'min_samples_split': 29, 'min_samples_leaf': 20, 'max_features': 0.5022790118950793}. Best is trial 13 with value: 0.3363638140844673.
[I 2026-06-21 18:36:16,924] A new study created in memory with name: xgboost_tuning
[I 2026-06-21 18:36:22,362] Trial 0 finished with value: 0.3473650288677951 and parameters: {'k_features': 48, 'n_estimators': 996, 'learning_rate': 0.07196277833335797, 'max_depth': 10, 'min_child_weight': 0.01264885522957405, 'subsample': 0.9624163853154785, 'colsample_bytree': 0.6079109947178749, 'reg_alpha': 2.9254234190627355e-05, 'reg_lambda': 1.690423985344361e-06}. Best is trial 0 with value: 0.3473650288677951.
[I 2026-06-21 18:36:23,325] Trial 1 finished with value: 0.35829218586762546 and parameters: {'k_features': 6, 'n_estimators': 296, 'learning_rate': 0.07324903744790426, 'max_depth': 2, 'min_child_weight': 1.072857011370629, 'subsample': 0.9955848683067243, 'colsample_bytree': 0.6392772126893974, 'reg_alpha': 1.0459413007122192e-07, 'reg_lambda': 5.840476791630387e-08}. Best is trial 0 with value: 0.3473650288677951.
[I 2026-06-21 18:36:25,334] Trial 2 finished with value: 0.3576687237545618 and parameters: {'k_features': 12, 'n_estimators': 115, 'learning_rate': 0.032747009290551805, 'max_depth': 9, 'min_child_weight': 0.019580033640209295, 'subsample': 0.7022376602479865, 'colsample_bytree': 0.8881856454559687, 'reg_alpha': 4.5426231727362894e-06, 'reg_lambda': 2.1785301761726148e-08}. Best is trial 0 with value: 0.3473650288677951.
[I 2026-06-21 18:36:26,559] Trial 3 finished with value: 0.33766674762018384 and parameters: {'k_features': 82, 'n_estimators': 354, 'learning_rate': 0.014097437352037048, 'max_depth': 2, 'min_child_weight': 0.06912458322331795, 'subsample': 0.647055719919153, 'colsample_bytree': 0.6629297953353128, 'reg_alpha': 3.302720608829661e-05, 'reg_lambda': 3.6465962277456764e-05}. Best is trial 3 with value: 0.33766674762018384.
[I 2026-06-21 18:36:27,771] Trial 4 finished with value: 0.34398745729807173 and parameters: {'k_features': 93, 'n_estimators': 145, 'learning_rate': 0.0067606253461938, 'max_depth': 5, 'min_child_weight': 0.09393678654101337, 'subsample': 0.9853240502914427, 'colsample_bytree': 0.8579869732646872, 'reg_alpha': 9.225643924984436e-05, 'reg_lambda': 5.7864232507459006e-05}. Best is trial 3 with value: 0.33766674762018384.
[I 2026-06-21 18:36:30,195] Trial 5 finished with value: 0.34696227934928203 and parameters: {'k_features': 21, 'n_estimators': 330, 'learning_rate': 0.11649080515686197, 'max_depth': 7, 'min_child_weight': 0.25487680947278896, 'subsample': 0.8368816230850851, 'colsample_bytree': 0.8587941348279851, 'reg_alpha': 1.3003069566166372, 'reg_lambda': 0.2306116357299306}. Best is trial 3 with value: 0.33766674762018384.
[I 2026-06-21 18:36:32,839] Trial 6 finished with value: 0.33842232919554677 and parameters: {'k_features': 45, 'n_estimators': 877, 'learning_rate': 0.005085579434829718, 'max_depth': 4, 'min_child_weight': 0.011531973992613928, 'subsample': 0.817811157078268, 'colsample_bytree': 0.9584333004036282, 'reg_alpha': 2.2915395081858433e-08, 'reg_lambda': 0.00011038763324673353}. Best is trial 3 with value: 0.33766674762018384.
[I 2026-06-21 18:36:34,084] Trial 7 finished with value: 0.33856125833333856 and parameters: {'k_features': 66, 'n_estimators': 556, 'learning_rate': 0.12626776509571522, 'max_depth': 3, 'min_child_weight': 0.018935382844878192, 'subsample': 0.784217737554527, 'colsample_bytree': 0.6512312077093776, 'reg_alpha': 9.954862537446473, 'reg_lambda': 7.389358154419455e-07}. Best is trial 3 with value: 0.33766674762018384.
[I 2026-06-21 18:36:37,050] Trial 8 finished with value: 0.3572293372625647 and parameters: {'k_features': 10, 'n_estimators': 525, 'learning_rate': 0.009230758990392713, 'max_depth': 7, 'min_child_weight': 0.02869402368942205, 'subsample': 0.9927084473594232, 'colsample_bytree': 0.7309926964377889, 'reg_alpha': 1.913379191584798e-05, 'reg_lambda': 7.006547023648438e-06}. Best is trial 3 with value: 0.33766674762018384.
[I 2026-06-21 18:36:40,024] Trial 9 finished with value: 0.3580634230960572 and parameters: {'k_features': 69, 'n_estimators': 884, 'learning_rate': 0.1457194639666894, 'max_depth': 5, 'min_child_weight': 5.749056326724913, 'subsample': 0.8040231302178993, 'colsample_bytree': 0.8909219745181571, 'reg_alpha': 1.678794303884639e-07, 'reg_lambda': 0.0006076332320470163}. Best is trial 3 with value: 0.33766674762018384.
[I 2026-06-21 18:36:42,929] Trial 10 finished with value: 0.34083699218833186 and parameters: {'k_features': 87, 'n_estimators': 668, 'learning_rate': 0.013669385798538857, 'max_depth': 7, 'min_child_weight': 18.979817948523017, 'subsample': 0.608559876336288, 'colsample_bytree': 0.7422596323921316, 'reg_alpha': 0.01939709623772579, 'reg_lambda': 1.7681537369540388}. Best is trial 3 with value: 0.33766674762018384.
[I 2026-06-21 18:36:45,400] Trial 11 finished with value: 0.34508755881050235 and parameters: {'k_features': 38, 'n_estimators': 765, 'learning_rate': 0.016468375710995967, 'max_depth': 4, 'min_child_weight': 0.10801159358522404, 'subsample': 0.6005990886724535, 'colsample_bytree': 0.9957312125262888, 'reg_alpha': 1.062616341878662e-08, 'reg_lambda': 0.010165190076124764}. Best is trial 3 with value: 0.33766674762018384.
[I 2026-06-21 18:36:46,605] Trial 12 finished with value: 0.34067381786721057 and parameters: {'k_features': 60, 'n_estimators': 413, 'learning_rate': 0.005254222765714508, 'max_depth': 2, 'min_child_weight': 0.08711294760172514, 'subsample': 0.6918608937230261, 'colsample_bytree': 0.9883634916409452, 'reg_alpha': 0.0009845218717860452, 'reg_lambda': 0.0006300474606227809}. Best is trial 3 with value: 0.33766674762018384.
[I 2026-06-21 18:36:49,107] Trial 13 finished with value: 0.3475726314630943 and parameters: {'k_features': 82, 'n_estimators': 757, 'learning_rate': 0.025023699630057673, 'max_depth': 4, 'min_child_weight': 0.38928656800778877, 'subsample': 0.8918843152699995, 'colsample_bytree': 0.7758508892552651, 'reg_alpha': 0.005148838313266948, 'reg_lambda': 0.00016148903591008855}. Best is trial 3 with value: 0.33766674762018384.
[I 2026-06-21 18:36:50,594] Trial 14 finished with value: 0.33756897347093057 and parameters: {'k_features': 31, 'n_estimators': 514, 'learning_rate': 0.0113276497184368, 'max_depth': 3, 'min_child_weight': 0.04626462442884321, 'subsample': 0.7074536683757358, 'colsample_bytree': 0.7990143838638071, 'reg_alpha': 8.422580063873605e-07, 'reg_lambda': 0.06878078432100866}. Best is trial 14 with value: 0.33756897347093057.
[I 2026-06-21 18:36:51,842] Trial 15 finished with value: 0.3378761069985631 and parameters: {'k_features': 30, 'n_estimators': 476, 'learning_rate': 0.012211661062544617, 'max_depth': 2, 'min_child_weight': 0.04436467550274502, 'subsample': 0.6908127098412263, 'colsample_bytree': 0.6922258747552167, 'reg_alpha': 5.774708526893333e-07, 'reg_lambda': 0.04080523990702674}. Best is trial 14 with value: 0.33756897347093057.
[I 2026-06-21 18:36:53,034] Trial 16 finished with value: 0.33839636774991316 and parameters: {'k_features': 98, 'n_estimators': 310, 'learning_rate': 0.02393364310231541, 'max_depth': 3, 'min_child_weight': 0.5568339140110146, 'subsample': 0.7362071823116012, 'colsample_bytree': 0.8027717608294676, 'reg_alpha': 1.722832833961291e-06, 'reg_lambda': 4.567162507237359}. Best is trial 14 with value: 0.33756897347093057.
[I 2026-06-21 18:36:54,608] Trial 17 finished with value: 0.34875875667706957 and parameters: {'k_features': 79, 'n_estimators': 618, 'learning_rate': 0.04126308834715701, 'max_depth': 3, 'min_child_weight': 1.5988062320911887, 'subsample': 0.6461709282618648, 'colsample_bytree': 0.6848958674602195, 'reg_alpha': 0.0004013909115295698, 'reg_lambda': 0.004947310734787748}. Best is trial 14 with value: 0.33756897347093057.
[I 2026-06-21 18:36:55,988] Trial 18 finished with value: 0.339282741605722 and parameters: {'k_features': 55, 'n_estimators': 210, 'learning_rate': 0.009077003076065026, 'max_depth': 5, 'min_child_weight': 0.045417693886421764, 'subsample': 0.751374694334383, 'colsample_bytree': 0.8051153957550337, 'reg_alpha': 0.027864594475265812, 'reg_lambda': 0.28488450538747706}. Best is trial 14 with value: 0.33756897347093057.
[I 2026-06-21 18:36:58,782] Trial 19 finished with value: 0.3444410841120119 and parameters: {'k_features': 26, 'n_estimators': 409, 'learning_rate': 0.01968445833855579, 'max_depth': 6, 'min_child_weight': 0.19842003752974674, 'subsample': 0.6506482843070287, 'colsample_bytree': 0.7153146569834289, 'reg_alpha': 3.991343625975896e-06, 'reg_lambda': 1.2541829099127151e-05}. Best is trial 14 with value: 0.33756897347093057.
[I 2026-06-21 18:36:59,889] Trial 20 finished with value: 0.33892344035914246 and parameters: {'k_features': 74, 'n_estimators': 245, 'learning_rate': 0.009101019763437076, 'max_depth': 3, 'min_child_weight': 0.057518219118892946, 'subsample': 0.6504651689013954, 'colsample_bytree': 0.7588113858613605, 'reg_alpha': 7.672148331414019e-05, 'reg_lambda': 1.950588962194349e-07}. Best is trial 14 with value: 0.33756897347093057.
[I 2026-06-21 18:37:01,074] Trial 21 finished with value: 0.33777244162849557 and parameters: {'k_features': 33, 'n_estimators': 451, 'learning_rate': 0.013529357797233445, 'max_depth': 2, 'min_child_weight': 0.03530702395472629, 'subsample': 0.6947118392040036, 'colsample_bytree': 0.6718794558853362, 'reg_alpha': 4.6301159067295927e-07, 'reg_lambda': 0.026377699943099717}. Best is trial 14 with value: 0.33756897347093057.
[I 2026-06-21 18:37:02,217] Trial 22 finished with value: 0.3384934249331241 and parameters: {'k_features': 36, 'n_estimators': 396, 'learning_rate': 0.012339231982764159, 'max_depth': 2, 'min_child_weight': 0.19839694686722148, 'subsample': 0.7368287107682849, 'colsample_bytree': 0.6674797939873579, 'reg_alpha': 4.093644558328172e-07, 'reg_lambda': 0.006430741765812283}. Best is trial 14 with value: 0.33756897347093057.
[I 2026-06-21 18:37:03,464] Trial 23 finished with value: 0.3376881047489338 and parameters: {'k_features': 22, 'n_estimators': 510, 'learning_rate': 0.017760428840590287, 'max_depth': 2, 'min_child_weight': 0.0316802502212327, 'subsample': 0.6764842974218451, 'colsample_bytree': 0.611316597064082, 'reg_alpha': 5.236805799675054e-06, 'reg_lambda': 0.18550112721437734}. Best is trial 14 with value: 0.33756897347093057.
[I 2026-06-21 18:37:04,981] Trial 24 finished with value: 0.34823681538391754 and parameters: {'k_features': 21, 'n_estimators': 590, 'learning_rate': 0.03485318903102263, 'max_depth': 3, 'min_child_weight': 0.10193170869522555, 'subsample': 0.639746238127439, 'colsample_bytree': 0.620653589109004, 'reg_alpha': 1.0537600171301101e-05, 'reg_lambda': 0.3542646796119419}. Best is trial 14 with value: 0.33756897347093057.
[I 2026-06-21 18:37:06,894] Trial 25 finished with value: 0.34840768862183236 and parameters: {'k_features': 17, 'n_estimators': 672, 'learning_rate': 0.02090942622933487, 'max_depth': 4, 'min_child_weight': 0.06363536950788239, 'subsample': 0.6704645929875577, 'colsample_bytree': 0.6009368279216263, 'reg_alpha': 0.00048799007174511077, 'reg_lambda': 1.3479116308507284}. Best is trial 14 with value: 0.33756897347093057.
[I 2026-06-21 18:37:08,166] Trial 26 finished with value: 0.33862300119071975 and parameters: {'k_features': 49, 'n_estimators': 503, 'learning_rate': 0.016614812652235345, 'max_depth': 2, 'min_child_weight': 0.14828768466221054, 'subsample': 0.7602003675623398, 'colsample_bytree': 0.7007910345279813, 'reg_alpha': 5.759493278863549e-08, 'reg_lambda': 0.001273824009440169}. Best is trial 14 with value: 0.33756897347093057.
[I 2026-06-21 18:37:09,562] Trial 27 finished with value: 0.33837774610057014 and parameters: {'k_features': 42, 'n_estimators': 357, 'learning_rate': 0.007393642711433684, 'max_depth': 3, 'min_child_weight': 0.02202540834416097, 'subsample': 0.710618612586318, 'colsample_bytree': 0.8004897304345484, 'reg_alpha': 2.7256071768177764e-06, 'reg_lambda': 0.06683453013522699}. Best is trial 14 with value: 0.33756897347093057.
[I 2026-06-21 18:37:10,772] Trial 28 finished with value: 0.3389816371336221 and parameters: {'k_features': 54, 'n_estimators': 238, 'learning_rate': 0.028452999213153227, 'max_depth': 4, 'min_child_weight': 0.032488785572692795, 'subsample': 0.6225663434544088, 'colsample_bytree': 0.6374415725612872, 'reg_alpha': 9.143318364223151e-05, 'reg_lambda': 6.2420479709874455}. Best is trial 14 with value: 0.33756897347093057.
[I 2026-06-21 18:37:17,341] Trial 29 finished with value: 0.34822727706503065 and parameters: {'k_features': 26, 'n_estimators': 653, 'learning_rate': 0.0466087652444665, 'max_depth': 10, 'min_child_weight': 0.010778715600488124, 'subsample': 0.9272343373397338, 'colsample_bytree': 0.6058741438800378, 'reg_alpha': 2.5808188707503868e-05, 'reg_lambda': 2.2396934804197355e-05}. Best is trial 14 with value: 0.33756897347093057.
[I 2026-06-21 18:37:24,297] Trial 30 finished with value: 0.35426630889361793 and parameters: {'k_features': 14, 'n_estimators': 557, 'learning_rate': 0.016601112744181083, 'max_depth': 9, 'min_child_weight': 0.39396567610422606, 'subsample': 0.6655134986756546, 'colsample_bytree': 0.838105508154617, 'reg_alpha': 1.3452346581628963e-06, 'reg_lambda': 2.069743090756031e-06}. Best is trial 14 with value: 0.33756897347093057.
[I 2026-06-21 18:37:25,487] Trial 31 finished with value: 0.33807450523240795 and parameters: {'k_features': 33, 'n_estimators': 462, 'learning_rate': 0.010745584536841504, 'max_depth': 2, 'min_child_weight': 0.030672961335557903, 'subsample': 0.7211622333206091, 'colsample_bytree': 0.6537532872955539, 'reg_alpha': 4.3753814582705317e-07, 'reg_lambda': 0.03546250930567869}. Best is trial 14 with value: 0.33756897347093057.
[I 2026-06-21 18:37:26,571] Trial 32 finished with value: 0.35314474870183526 and parameters: {'k_features': 7, 'n_estimators': 461, 'learning_rate': 0.015123071061859835, 'max_depth': 2, 'min_child_weight': 0.01675704657481554, 'subsample': 0.6773986327725408, 'colsample_bytree': 0.6283645538097408, 'reg_alpha': 8.002418747033424e-06, 'reg_lambda': 0.01593696845446859}. Best is trial 14 with value: 0.33756897347093057.
[I 2026-06-21 18:37:27,684] Trial 33 finished with value: 0.33810569484939546 and parameters: {'k_features': 40, 'n_estimators': 367, 'learning_rate': 0.020762856207983096, 'max_depth': 2, 'min_child_weight': 0.0534661489361231, 'subsample': 0.7089922536395721, 'colsample_bytree': 0.6661810465651051, 'reg_alpha': 1.2331958275275946e-07, 'reg_lambda': 0.09103170485949073}. Best is trial 14 with value: 0.33756897347093057.
