[I 2026-06-21 18:17:17,050] A new study created in memory with name: lightgbm_tuning
[I 2026-06-21 18:17:19,483] Trial 0 finished with value: 0.3552478543759906 and parameters: {'k_features': 79, 'n_estimators': 484, 'learning_rate': 0.1169808319885963, 'num_leaves': 42, 'max_depth': 9, 'min_child_samples': 23, 'subsample': 0.656042418529559, 'colsample_bytree': 0.646753645919055, 'reg_alpha': 0.03345833459796642, 'reg_lambda': 0.04511029411665706}. Best is trial 0 with value: 0.3552478543759906.
[I 2026-06-21 18:17:22,773] Trial 1 finished with value: 0.35148159275727076 and parameters: {'k_features': 92, 'n_estimators': 593, 'learning_rate': 0.05293314402482152, 'num_leaves': 114, 'max_depth': 12, 'min_child_samples': 17, 'subsample': 0.8837379971575454, 'colsample_bytree': 0.8305800385418096, 'reg_alpha': 0.03805040808050684, 'reg_lambda': 3.6212884737555152e-06}. Best is trial 1 with value: 0.35148159275727076.
[I 2026-06-21 18:17:23,950] Trial 2 finished with value: 0.33704067791542286 and parameters: {'k_features': 36, 'n_estimators': 569, 'learning_rate': 0.006031366529120091, 'num_leaves': 102, 'max_depth': 8, 'min_child_samples': 75, 'subsample': 0.9335071047051957, 'colsample_bytree': 0.6852709794794747, 'reg_alpha': 0.6620923057244645, 'reg_lambda': 1.481418520098757e-07}. Best is trial 2 with value: 0.33704067791542286.
[I 2026-06-21 18:17:26,301] Trial 3 finished with value: 0.3426173304714998 and parameters: {'k_features': 71, 'n_estimators': 1000, 'learning_rate': 0.009699965665632339, 'num_leaves': 67, 'max_depth': 10, 'min_child_samples': 36, 'subsample': 0.701865749131898, 'colsample_bytree': 0.7946066565667448, 'reg_alpha': 3.823228061963077e-06, 'reg_lambda': 0.003891733559753197}. Best is trial 2 with value: 0.33704067791542286.
[I 2026-06-21 18:17:27,643] Trial 4 finished with value: 0.3595902708597868 and parameters: {'k_features': 46, 'n_estimators': 677, 'learning_rate': 0.10789074792324964, 'num_leaves': 19, 'max_depth': 8, 'min_child_samples': 58, 'subsample': 0.9938494243934038, 'colsample_bytree': 0.9699914574282302, 'reg_alpha': 0.03703503833426944, 'reg_lambda': 0.23213525523436543}. Best is trial 2 with value: 0.33704067791542286.
[I 2026-06-21 18:17:29,443] Trial 5 finished with value: 0.3558862886533187 and parameters: {'k_features': 68, 'n_estimators': 646, 'learning_rate': 0.1386487584675306, 'num_leaves': 41, 'max_depth': 11, 'min_child_samples': 6, 'subsample': 0.6347659322986504, 'colsample_bytree': 0.6425035617114191, 'reg_alpha': 0.0019407203932446505, 'reg_lambda': 0.00035678078963405515}. Best is trial 2 with value: 0.33704067791542286.
[I 2026-06-21 18:17:30,461] Trial 6 finished with value: 0.33867096972746175 and parameters: {'k_features': 73, 'n_estimators': 351, 'learning_rate': 0.005542653953729352, 'num_leaves': 43, 'max_depth': 6, 'min_child_samples': 37, 'subsample': 0.9798284530594619, 'colsample_bytree': 0.779459981127459, 'reg_alpha': 4.5999742476337544e-07, 'reg_lambda': 3.3265535730740824e-05}. Best is trial 2 with value: 0.33704067791542286.
[I 2026-06-21 18:17:31,394] Trial 7 finished with value: 0.34628441971446455 and parameters: {'k_features': 50, 'n_estimators': 122, 'learning_rate': 0.05080065830894614, 'num_leaves': 124, 'max_depth': 10, 'min_child_samples': 15, 'subsample': 0.8013906940211726, 'colsample_bytree': 0.9218656400348609, 'reg_alpha': 5.3063059822424477e-05, 'reg_lambda': 0.049751296191330854}. Best is trial 2 with value: 0.33704067791542286.
[I 2026-06-21 18:17:32,524] Trial 8 finished with value: 0.3610030580899866 and parameters: {'k_features': 15, 'n_estimators': 272, 'learning_rate': 0.0660317974589149, 'num_leaves': 115, 'max_depth': 10, 'min_child_samples': 26, 'subsample': 0.965137905523563, 'colsample_bytree': 0.8977458562820311, 'reg_alpha': 1.1447519075457977, 'reg_lambda': 1.8962023452680591e-06}. Best is trial 2 with value: 0.33704067791542286.
[I 2026-06-21 18:17:33,913] Trial 9 finished with value: 0.3416230795395904 and parameters: {'k_features': 56, 'n_estimators': 499, 'learning_rate': 0.022539939579305102, 'num_leaves': 95, 'max_depth': 6, 'min_child_samples': 16, 'subsample': 0.6882830956251597, 'colsample_bytree': 0.9006197205665283, 'reg_alpha': 1.2445192301928545e-07, 'reg_lambda': 1.248817831915984}. Best is trial 2 with value: 0.33704067791542286.
[I 2026-06-21 18:17:34,824] Trial 10 finished with value: 0.3517579686599341 and parameters: {'k_features': 9, 'n_estimators': 880, 'learning_rate': 0.016736764702063093, 'num_leaves': 85, 'max_depth': 3, 'min_child_samples': 80, 'subsample': 0.7914718796390267, 'colsample_bytree': 0.6999235322662367, 'reg_alpha': 7.998279661142397, 'reg_lambda': 1.416480379151711e-08}. Best is trial 2 with value: 0.33704067791542286.
[I 2026-06-21 18:17:35,819] Trial 11 finished with value: 0.3384479575676589 and parameters: {'k_features': 35, 'n_estimators': 330, 'learning_rate': 0.006218492473850616, 'num_leaves': 64, 'max_depth': 6, 'min_child_samples': 51, 'subsample': 0.9020641299489811, 'colsample_bytree': 0.7290658484402635, 'reg_alpha': 1.084331941681381e-08, 'reg_lambda': 4.379660056240365e-06}. Best is trial 2 with value: 0.33704067791542286.
[I 2026-06-21 18:17:36,791] Trial 12 finished with value: 0.3386482420924609 and parameters: {'k_features': 27, 'n_estimators': 334, 'learning_rate': 0.005137602340374007, 'num_leaves': 71, 'max_depth': 6, 'min_child_samples': 71, 'subsample': 0.887655496767036, 'colsample_bytree': 0.7276357916965681, 'reg_alpha': 2.379040055812895e-08, 'reg_lambda': 3.204769007195901e-08}. Best is trial 2 with value: 0.33704067791542286.
[I 2026-06-21 18:17:37,973] Trial 13 finished with value: 0.3382108993264742 and parameters: {'k_features': 29, 'n_estimators': 742, 'learning_rate': 0.010419417863845868, 'num_leaves': 96, 'max_depth': 4, 'min_child_samples': 55, 'subsample': 0.8808051279231078, 'colsample_bytree': 0.7051094755759925, 'reg_alpha': 0.00011854889402580875, 'reg_lambda': 4.053173890596415e-07}. Best is trial 2 with value: 0.33704067791542286.
[I 2026-06-21 18:17:39,040] Trial 14 finished with value: 0.3378700712276499 and parameters: {'k_features': 28, 'n_estimators': 792, 'learning_rate': 0.013271481479075338, 'num_leaves': 99, 'max_depth': 3, 'min_child_samples': 60, 'subsample': 0.8177033842922616, 'colsample_bytree': 0.626115963547215, 'reg_alpha': 0.0005155700683672808, 'reg_lambda': 2.0740555070260889e-07}. Best is trial 2 with value: 0.33704067791542286.
[I 2026-06-21 18:17:40,309] Trial 15 finished with value: 0.34014554135941066 and parameters: {'k_features': 38, 'n_estimators': 780, 'learning_rate': 0.01980988306893502, 'num_leaves': 97, 'max_depth': 4, 'min_child_samples': 67, 'subsample': 0.7855091449189769, 'colsample_bytree': 0.6124765442760798, 'reg_alpha': 0.0009231974196436295, 'reg_lambda': 1.4131283127280968e-07}. Best is trial 2 with value: 0.33704067791542286.
[I 2026-06-21 18:17:41,970] Trial 16 finished with value: 0.3408055115228869 and parameters: {'k_features': 20, 'n_estimators': 868, 'learning_rate': 0.010122368750234773, 'num_leaves': 106, 'max_depth': 8, 'min_child_samples': 80, 'subsample': 0.8314292717099397, 'colsample_bytree': 0.6081177982050673, 'reg_alpha': 0.2548749734061917, 'reg_lambda': 7.993099021992689e-05}. Best is trial 2 with value: 0.33704067791542286.
[I 2026-06-21 18:17:42,866] Trial 17 finished with value: 0.3401061195409648 and parameters: {'k_features': 56, 'n_estimators': 517, 'learning_rate': 0.02996836502005773, 'num_leaves': 85, 'max_depth': 3, 'min_child_samples': 66, 'subsample': 0.9331067207430915, 'colsample_bytree': 0.6690324855717975, 'reg_alpha': 0.001268799279771665, 'reg_lambda': 1.652536549664974e-07}. Best is trial 2 with value: 0.33704067791542286.
[I 2026-06-21 18:17:44,459] Trial 18 finished with value: 0.34384910978234473 and parameters: {'k_features': 42, 'n_estimators': 832, 'learning_rate': 0.013551051245902989, 'num_leaves': 127, 'max_depth': 7, 'min_child_samples': 46, 'subsample': 0.7326711484060136, 'colsample_bytree': 0.7660939527955912, 'reg_alpha': 8.422651114400486e-06, 'reg_lambda': 1.03620558298475e-08}. Best is trial 2 with value: 0.33704067791542286.
[I 2026-06-21 18:17:45,772] Trial 19 finished with value: 0.3550544730435831 and parameters: {'k_features': 8, 'n_estimators': 986, 'learning_rate': 0.007778225246817967, 'num_leaves': 81, 'max_depth': 5, 'min_child_samples': 61, 'subsample': 0.8266160320417266, 'colsample_bytree': 0.6705784256739948, 'reg_alpha': 2.4541392527746146, 'reg_lambda': 7.132738005193622e-07}. Best is trial 2 with value: 0.33704067791542286.
[I 2026-06-21 18:17:46,972] Trial 20 finished with value: 0.3451257555764806 and parameters: {'k_features': 24, 'n_estimators': 576, 'learning_rate': 0.032019352988651086, 'num_leaves': 107, 'max_depth': 12, 'min_child_samples': 74, 'subsample': 0.7516658939477785, 'colsample_bytree': 0.8402598869207066, 'reg_alpha': 0.005838918508982775, 'reg_lambda': 2.169472185173428e-05}. Best is trial 2 with value: 0.33704067791542286.
[I 2026-06-21 18:17:48,189] Trial 21 finished with value: 0.3383939564114994 and parameters: {'k_features': 31, 'n_estimators': 747, 'learning_rate': 0.010938481084973892, 'num_leaves': 97, 'max_depth': 4, 'min_child_samples': 54, 'subsample': 0.855711135633686, 'colsample_bytree': 0.7212218300682905, 'reg_alpha': 0.0001565085265930159, 'reg_lambda': 2.2393581896917552e-07}. Best is trial 2 with value: 0.33704067791542286.
[I 2026-06-21 18:17:49,340] Trial 22 finished with value: 0.3396997128157328 and parameters: {'k_features': 19, 'n_estimators': 712, 'learning_rate': 0.007235062470819015, 'num_leaves': 104, 'max_depth': 4, 'min_child_samples': 46, 'subsample': 0.9324884676367752, 'colsample_bytree': 0.6877057492329794, 'reg_alpha': 8.062776379910038e-05, 'reg_lambda': 9.081907571222925e-08}. Best is trial 2 with value: 0.33704067791542286.
[I 2026-06-21 18:17:50,483] Trial 23 finished with value: 0.33877347747912046 and parameters: {'k_features': 34, 'n_estimators': 918, 'learning_rate': 0.013625228313978567, 'num_leaves': 78, 'max_depth': 3, 'min_child_samples': 61, 'subsample': 0.9290137705789169, 'colsample_bytree': 0.628926216561246, 'reg_alpha': 1.003731907748707e-05, 'reg_lambda': 6.949775746849839e-07}. Best is trial 2 with value: 0.33704067791542286.
[I 2026-06-21 18:17:51,728] Trial 24 finished with value: 0.33771996821619954 and parameters: {'k_features': 27, 'n_estimators': 798, 'learning_rate': 0.008592638761486348, 'num_leaves': 94, 'max_depth': 5, 'min_child_samples': 72, 'subsample': 0.8536181893198088, 'colsample_bytree': 0.7521767905394537, 'reg_alpha': 0.2682455647846424, 'reg_lambda': 8.399781473443831e-06}. Best is trial 2 with value: 0.33704067791542286.
[I 2026-06-21 18:17:52,940] Trial 25 finished with value: 0.33754022929715843 and parameters: {'k_features': 51, 'n_estimators': 619, 'learning_rate': 0.008307360500442437, 'num_leaves': 116, 'max_depth': 5, 'min_child_samples': 73, 'subsample': 0.8562916872816194, 'colsample_bytree': 0.7562970092203494, 'reg_alpha': 0.3112902461730049, 'reg_lambda': 0.000433550068226604}. Best is trial 2 with value: 0.33704067791542286.
[I 2026-06-21 18:17:53,969] Trial 26 finished with value: 0.337291736153405 and parameters: {'k_features': 58, 'n_estimators': 425, 'learning_rate': 0.007797996985451205, 'num_leaves': 116, 'max_depth': 7, 'min_child_samples': 74, 'subsample': 0.8563577897999036, 'colsample_bytree': 0.8091008086451494, 'reg_alpha': 0.20631181800769915, 'reg_lambda': 0.0008495939378321608}. Best is trial 2 with value: 0.33704067791542286.
[I 2026-06-21 18:17:55,040] Trial 27 finished with value: 0.33751265494848737 and parameters: {'k_features': 61, 'n_estimators': 427, 'learning_rate': 0.006769527851810659, 'num_leaves': 119, 'max_depth': 8, 'min_child_samples': 77, 'subsample': 0.9558891565633596, 'colsample_bytree': 0.8141547342085076, 'reg_alpha': 0.2803327304922205, 'reg_lambda': 0.0014933179930152467}. Best is trial 2 with value: 0.33704067791542286.
[I 2026-06-21 18:17:56,183] Trial 28 finished with value: 0.33761705180378493 and parameters: {'k_features': 63, 'n_estimators': 453, 'learning_rate': 0.006242254484516224, 'num_leaves': 120, 'max_depth': 7, 'min_child_samples': 77, 'subsample': 0.9479531698927064, 'colsample_bytree': 0.8306524194258446, 'reg_alpha': 0.007539866530082542, 'reg_lambda': 0.0023398001242716164}. Best is trial 2 with value: 0.33704067791542286.
[I 2026-06-21 18:17:57,252] Trial 29 finished with value: 0.33752597176406834 and parameters: {'k_features': 89, 'n_estimators': 409, 'learning_rate': 0.005084391138056349, 'num_leaves': 128, 'max_depth': 9, 'min_child_samples': 67, 'subsample': 0.9143159011955283, 'colsample_bytree': 0.8110509680993602, 'reg_alpha': 0.08809119098959586, 'reg_lambda': 0.010729208458318217}. Best is trial 2 with value: 0.33704067791542286.
[I 2026-06-21 18:17:58,154] Trial 30 finished with value: 0.34052792485816274 and parameters: {'k_features': 80, 'n_estimators': 216, 'learning_rate': 0.00642620028024945, 'num_leaves': 111, 'max_depth': 8, 'min_child_samples': 66, 'subsample': 0.9592513439956408, 'colsample_bytree': 0.8683862332601034, 'reg_alpha': 1.2839825772000495, 'reg_lambda': 0.00015766295854620604}. Best is trial 2 with value: 0.33704067791542286.
[I 2026-06-21 18:17:59,275] Trial 31 finished with value: 0.33754129682171913 and parameters: {'k_features': 87, 'n_estimators': 427, 'learning_rate': 0.0050626642664703455, 'num_leaves': 128, 'max_depth': 9, 'min_child_samples': 67, 'subsample': 0.9125456917027981, 'colsample_bytree': 0.8016634936573488, 'reg_alpha': 0.11600445652268539, 'reg_lambda': 0.007865501899658086}. Best is trial 2 with value: 0.33704067791542286.
[I 2026-06-21 18:18:00,327] Trial 32 finished with value: 0.3374367260865935 and parameters: {'k_features': 98, 'n_estimators': 404, 'learning_rate': 0.007407095917362279, 'num_leaves': 119, 'max_depth': 9, 'min_child_samples': 76, 'subsample': 0.9071083756423484, 'colsample_bytree': 0.864656904712004, 'reg_alpha': 0.01277329547819264, 'reg_lambda': 0.02117142715622046}. Best is trial 2 with value: 0.33704067791542286.
[I 2026-06-21 18:18:01,882] Trial 33 finished with value: 0.3373187077041345 and parameters: {'k_features': 99, 'n_estimators': 546, 'learning_rate': 0.007311944268754394, 'num_leaves': 118, 'max_depth': 9, 'min_child_samples': 76, 'subsample': 0.877784450663245, 'colsample_bytree': 0.8604147649647051, 'reg_alpha': 0.014374487217989649, 'reg_lambda': 6.592312287918758}. Best is trial 2 with value: 0.33704067791542286.
[I 2026-06-21 18:18:03,558] Trial 34 finished with value: 0.3386906424462793 and parameters: {'k_features': 100, 'n_estimators': 548, 'learning_rate': 0.008715765632181656, 'num_leaves': 111, 'max_depth': 9, 'min_child_samples': 75, 'subsample': 0.8740507360147709, 'colsample_bytree': 0.9553547442846472, 'reg_alpha': 0.01368245677463703, 'reg_lambda': 5.3416110902804474}. Best is trial 2 with value: 0.33704067791542286.
[I 2026-06-21 18:18:05,028] Trial 35 finished with value: 0.3389975439612615 and parameters: {'k_features': 100, 'n_estimators': 558, 'learning_rate': 0.011663777139562903, 'num_leaves': 120, 'max_depth': 11, 'min_child_samples': 70, 'subsample': 0.9948258866354194, 'colsample_bytree': 0.8601476825649709, 'reg_alpha': 0.0345612527981183, 'reg_lambda': 0.126679761984053}. Best is trial 2 with value: 0.33704067791542286.
[I 2026-06-21 18:18:06,039] Trial 36 finished with value: 0.3398575852620131 and parameters: {'k_features': 93, 'n_estimators': 378, 'learning_rate': 0.007788812622376084, 'num_leaves': 106, 'max_depth': 7, 'min_child_samples': 77, 'subsample': 0.9014297103136645, 'colsample_bytree': 0.8731839458804947, 'reg_alpha': 7.67504194494439, 'reg_lambda': 0.6015378294947955}. Best is trial 2 with value: 0.33704067791542286.
[I 2026-06-21 18:18:07,179] Trial 37 finished with value: 0.3392729365184026 and parameters: {'k_features': 83, 'n_estimators': 483, 'learning_rate': 0.0165218196533459, 'num_leaves': 112, 'max_depth': 10, 'min_child_samples': 80, 'subsample': 0.6141272665009776, 'colsample_bytree': 0.9391956700201316, 'reg_alpha': 0.004017598670441298, 'reg_lambda': 9.549542314965922}. Best is trial 2 with value: 0.33704067791542286.
[I 2026-06-21 18:18:08,804] Trial 38 finished with value: 0.3383196632590431 and parameters: {'k_features': 75, 'n_estimators': 658, 'learning_rate': 0.009370947995128524, 'num_leaves': 18, 'max_depth': 9, 'min_child_samples': 63, 'subsample': 0.8652679671978315, 'colsample_bytree': 0.8973741867654471, 'reg_alpha': 0.03296476876827287, 'reg_lambda': 0.020637679531826904}. Best is trial 2 with value: 0.33704067791542286.
[I 2026-06-21 18:18:09,768] Trial 39 finished with value: 0.33885467345459463 and parameters: {'k_features': 97, 'n_estimators': 257, 'learning_rate': 0.006537238844690315, 'num_leaves': 89, 'max_depth': 7, 'min_child_samples': 71, 'subsample': 0.8426621730974497, 'colsample_bytree': 0.9195228851995856, 'reg_alpha': 0.014948586086906536, 'reg_lambda': 2.122712199896187}. Best is trial 2 with value: 0.33704067791542286.
[I 2026-06-21 18:18:11,006] Trial 40 finished with value: 0.3522614908626732 and parameters: {'k_features': 84, 'n_estimators': 619, 'learning_rate': 0.09385219776951521, 'num_leaves': 102, 'max_depth': 8, 'min_child_samples': 70, 'subsample': 0.9763089663354908, 'colsample_bytree': 0.7806718790838375, 'reg_alpha': 1.0002100185702143, 'reg_lambda': 0.06544968789326193}. Best is trial 2 with value: 0.33704067791542286.
[I 2026-06-21 18:18:12,111] Trial 41 finished with value: 0.3375483994620019 and parameters: {'k_features': 65, 'n_estimators': 461, 'learning_rate': 0.007019632558633311, 'num_leaves': 118, 'max_depth': 8, 'min_child_samples': 76, 'subsample': 0.9500105229168969, 'colsample_bytree': 0.8465607967722683, 'reg_alpha': 0.1309914833163144, 'reg_lambda': 0.33519286679754895}. Best is trial 2 with value: 0.33704067791542286.
[I 2026-06-21 18:18:13,325] Trial 42 finished with value: 0.3380150993149316 and parameters: {'k_features': 58, 'n_estimators': 523, 'learning_rate': 0.005726383412023649, 'num_leaves': 122, 'max_depth': 11, 'min_child_samples': 77, 'subsample': 0.8937033078637892, 'colsample_bytree': 0.9895781835250209, 'reg_alpha': 0.5317508427830435, 'reg_lambda': 0.002011332776651457}. Best is trial 2 with value: 0.33704067791542286.
[I 2026-06-21 18:18:14,220] Trial 43 finished with value: 0.33916327836130405 and parameters: {'k_features': 94, 'n_estimators': 299, 'learning_rate': 0.006922975627989312, 'num_leaves': 114, 'max_depth': 9, 'min_child_samples': 80, 'subsample': 0.9191990837641959, 'colsample_bytree': 0.8204768986858876, 'reg_alpha': 2.9642277289613057, 'reg_lambda': 0.0006683800560399334}. Best is trial 2 with value: 0.33704067791542286.
[I 2026-06-21 18:18:15,353] Trial 44 finished with value: 0.3374204675297191 and parameters: {'k_features': 72, 'n_estimators': 387, 'learning_rate': 0.01166248058878145, 'num_leaves': 28, 'max_depth': 10, 'min_child_samples': 64, 'subsample': 0.9788618449955839, 'colsample_bytree': 0.8800301734639371, 'reg_alpha': 0.06154909790749103, 'reg_lambda': 0.0010672334284787647}. Best is trial 2 with value: 0.33704067791542286.
[I 2026-06-21 18:18:16,406] Trial 45 finished with value: 0.3377511453760398 and parameters: {'k_features': 75, 'n_estimators': 187, 'learning_rate': 0.011963281746651174, 'num_leaves': 27, 'max_depth': 10, 'min_child_samples': 57, 'subsample': 0.9987633482640391, 'colsample_bytree': 0.878211541318144, 'reg_alpha': 0.052047262949866016, 'reg_lambda': 6.355847778435515e-05}. Best is trial 2 with value: 0.33704067791542286.
[I 2026-06-21 18:18:17,432] Trial 46 finished with value: 0.3377355384566434 and parameters: {'k_features': 69, 'n_estimators': 376, 'learning_rate': 0.01559470930693731, 'num_leaves': 49, 'max_depth': 10, 'min_child_samples': 65, 'subsample': 0.9760586939353316, 'colsample_bytree': 0.9207091084864146, 'reg_alpha': 0.016927957661843716, 'reg_lambda': 0.024155588524157716}. Best is trial 2 with value: 0.33704067791542286.
[I 2026-06-21 18:18:18,908] Trial 47 finished with value: 0.34144114098846684 and parameters: {'k_features': 47, 'n_estimators': 366, 'learning_rate': 0.00964366269473484, 'num_leaves': 60, 'max_depth': 11, 'min_child_samples': 24, 'subsample': 0.8092959030349502, 'colsample_bytree': 0.8964322540160721, 'reg_alpha': 0.003059149646165347, 'reg_lambda': 0.004974772446032234}. Best is trial 2 with value: 0.33704067791542286.
[I 2026-06-21 18:18:20,156] Trial 48 finished with value: 0.34011789095928757 and parameters: {'k_features': 89, 'n_estimators': 305, 'learning_rate': 0.0057957546485134116, 'num_leaves': 26, 'max_depth': 11, 'min_child_samples': 32, 'subsample': 0.7719702246645279, 'colsample_bytree': 0.8485332016915835, 'reg_alpha': 0.0004251329570259262, 'reg_lambda': 0.0008697926652870124}. Best is trial 2 with value: 0.33704067791542286.
[I 2026-06-21 18:18:21,346] Trial 49 finished with value: 0.33705494437485367 and parameters: {'k_features': 78, 'n_estimators': 485, 'learning_rate': 0.008834925381602889, 'num_leaves': 47, 'max_depth': 8, 'min_child_samples': 69, 'subsample': 0.8788821580177615, 'colsample_bytree': 0.8847767406624397, 'reg_alpha': 0.0652580099086036, 'reg_lambda': 0.00020366768644169617}. Best is trial 2 with value: 0.33704067791542286.
[I 2026-06-21 18:18:22,073] A new study created in memory with name: catboost_tuning
[I 2026-06-21 18:18:25,840] Trial 0 finished with value: 0.3393219370071889 and parameters: {'k_features': 38, 'iterations': 808, 'learning_rate': 0.01499138710078287, 'depth': 4, 'l2_leaf_reg': 0.026673646935285244, 'random_strength': 0.005780549052055974}. Best is trial 0 with value: 0.3393219370071889.
