[I 2026-06-21 18:40:14,951] Trial 48 finished with value: 0.33858906847023496 and parameters: {'k_features': 87, 'hidden_layer_sizes': (128, 64), 'activation': 'tanh', 'alpha': 2.9226422217561773e-05, 'learning_rate_init': 0.00023832192639259035, 'batch_size': 32}. Best is trial 35 with value: 0.33778827059839334.
[I 2026-06-21 18:40:17,037] Trial 49 finished with value: 0.3645008223332037 and parameters: {'k_features': 79, 'hidden_layer_sizes': (64, 32), 'activation': 'tanh', 'alpha': 0.0007071382390667702, 'learning_rate_init': 0.00015809451169159077, 'batch_size': 128}. Best is trial 35 with value: 0.33778827059839334.

Rodando tuning: lightgbm

Rodando tuning: catboost

Rodando tuning: random_forest

Rodando tuning: xgboost

Rodando tuning: mlp

Resumo final:
      model_name  best_cv_rmse  ...   test_r2  n_selected_features
0       lightgbm      0.337041  ...  0.153488                   22
3        xgboost      0.336143  ...  0.144264                   22
2  random_forest      0.336364  ...  0.140663                   22
1       catboost      0.334425  ...  0.140339                   22
4            mlp      0.337788  ...  0.138378                   22

[5 rows x 6 columns]
