[I 2026-06-21 18:19:01,289] Trial 1 finished with value: 0.34504550267198664 and parameters: {'k_features': 40, 'iterations': 253, 'learning_rate': 0.09891832557825463, 'depth': 10, 'l2_leaf_reg': 0.0015681620988555543, 'random_strength': 0.002030053218720872}. Best is trial 0 with value: 0.3393219370071889.
[I 2026-06-21 18:19:06,887] Trial 2 finished with value: 0.3364305686960255 and parameters: {'k_features': 25, 'iterations': 617, 'learning_rate': 0.006881291687765608, 'depth': 6, 'l2_leaf_reg': 0.3293837850010353, 'random_strength': 0.7396054769122797}. Best is trial 2 with value: 0.3364305686960255.
[I 2026-06-21 18:19:10,737] Trial 3 finished with value: 0.34409401124031935 and parameters: {'k_features': 96, 'iterations': 863, 'learning_rate': 0.03724390983338609, 'depth': 4, 'l2_leaf_reg': 0.013620856046452742, 'random_strength': 1.0226383924875215}. Best is trial 2 with value: 0.3364305686960255.
[I 2026-06-21 18:19:33,372] Trial 4 finished with value: 0.3399947399225657 and parameters: {'k_features': 76, 'iterations': 414, 'learning_rate': 0.018613976919208557, 'depth': 9, 'l2_leaf_reg': 0.011278313640517743, 'random_strength': 0.00970097445397386}. Best is trial 2 with value: 0.3364305686960255.
[I 2026-06-21 18:19:35,101] Trial 5 finished with value: 0.35980185017683936 and parameters: {'k_features': 11, 'iterations': 156, 'learning_rate': 0.10732088398836676, 'depth': 6, 'l2_leaf_reg': 0.004386070200022608, 'random_strength': 0.7262602399626098}. Best is trial 2 with value: 0.3364305686960255.
[I 2026-06-21 18:19:40,794] Trial 6 finished with value: 0.3391063679128321 and parameters: {'k_features': 79, 'iterations': 389, 'learning_rate': 0.014207737883443936, 'depth': 7, 'l2_leaf_reg': 0.02334332877379387, 'random_strength': 0.005914070843759301}. Best is trial 2 with value: 0.3364305686960255.
[I 2026-06-21 18:19:44,474] Trial 7 finished with value: 0.33835125743394284 and parameters: {'k_features': 19, 'iterations': 626, 'learning_rate': 0.008446978249833922, 'depth': 5, 'l2_leaf_reg': 6.220964983537289, 'random_strength': 2.3706149812052915}. Best is trial 2 with value: 0.3364305686960255.
[I 2026-06-21 18:19:46,263] Trial 8 finished with value: 0.35468392939665655 and parameters: {'k_features': 6, 'iterations': 467, 'learning_rate': 0.013915943478813477, 'depth': 3, 'l2_leaf_reg': 0.0019953111454564455, 'random_strength': 0.0035650599524735503}. Best is trial 2 with value: 0.3364305686960255.
[I 2026-06-21 18:19:48,946] Trial 9 finished with value: 0.33936662766796416 and parameters: {'k_features': 84, 'iterations': 696, 'learning_rate': 0.021051921103705934, 'depth': 3, 'l2_leaf_reg': 0.0801820137792597, 'random_strength': 0.001645761839010879}. Best is trial 2 with value: 0.3364305686960255.
[I 2026-06-21 18:20:05,032] Trial 10 finished with value: 0.33847880237542943 and parameters: {'k_features': 52, 'iterations': 609, 'learning_rate': 0.005354781130697471, 'depth': 8, 'l2_leaf_reg': 0.7955283959029746, 'random_strength': 0.09425603697818004}. Best is trial 2 with value: 0.3364305686960255.
[I 2026-06-21 18:20:10,384] Trial 11 finished with value: 0.3421822727019054 and parameters: {'k_features': 21, 'iterations': 602, 'learning_rate': 0.005335224699554451, 'depth': 6, 'l2_leaf_reg': 18.90219258789681, 'random_strength': 4.301337178105933}. Best is trial 2 with value: 0.3364305686960255.
[I 2026-06-21 18:20:14,697] Trial 12 finished with value: 0.3373286459228787 and parameters: {'k_features': 28, 'iterations': 704, 'learning_rate': 0.008339338714301451, 'depth': 5, 'l2_leaf_reg': 2.9883330761521694, 'random_strength': 6.493489520246637}. Best is trial 2 with value: 0.3364305686960255.
[I 2026-06-21 18:20:21,423] Trial 13 finished with value: 0.3367968312907254 and parameters: {'k_features': 32, 'iterations': 759, 'learning_rate': 0.009401905943566446, 'depth': 6, 'l2_leaf_reg': 0.5879131282358319, 'random_strength': 0.2568852464590801}. Best is trial 2 with value: 0.3364305686960255.
[I 2026-06-21 18:20:34,724] Trial 14 finished with value: 0.33937675166773557 and parameters: {'k_features': 50, 'iterations': 965, 'learning_rate': 0.008391325011719589, 'depth': 7, 'l2_leaf_reg': 0.3365566761135, 'random_strength': 0.14413942173328564}. Best is trial 2 with value: 0.3364305686960255.
[I 2026-06-21 18:20:41,888] Trial 15 finished with value: 0.34209212637221215 and parameters: {'k_features': 61, 'iterations': 494, 'learning_rate': 0.0307384659893035, 'depth': 7, 'l2_leaf_reg': 0.23586017841122742, 'random_strength': 0.14096685451180407}. Best is trial 2 with value: 0.3364305686960255.
[I 2026-06-21 18:20:49,136] Trial 16 finished with value: 0.3376876023590828 and parameters: {'k_features': 32, 'iterations': 829, 'learning_rate': 0.009212395313071279, 'depth': 6, 'l2_leaf_reg': 1.1766236169996012, 'random_strength': 0.0343342997905435}. Best is trial 2 with value: 0.3364305686960255.
[I 2026-06-21 18:21:14,831] Trial 17 finished with value: 0.3445794293219552 and parameters: {'k_features': 47, 'iterations': 993, 'learning_rate': 0.04556326599959061, 'depth': 8, 'l2_leaf_reg': 0.12125263250038273, 'random_strength': 0.38031213649321993}. Best is trial 2 with value: 0.3364305686960255.
[I 2026-06-21 18:21:19,177] Trial 18 finished with value: 0.33761747290251193 and parameters: {'k_features': 63, 'iterations': 715, 'learning_rate': 0.005417006735657751, 'depth': 5, 'l2_leaf_reg': 1.0834169085563166, 'random_strength': 0.03146876530987781}. Best is trial 2 with value: 0.3364305686960255.
[I 2026-06-21 18:21:31,858] Trial 19 finished with value: 0.3401285104929691 and parameters: {'k_features': 19, 'iterations': 505, 'learning_rate': 0.010871234343719768, 'depth': 8, 'l2_leaf_reg': 0.06751253640729385, 'random_strength': 0.4018897648582264}. Best is trial 2 with value: 0.3364305686960255.
[I 2026-06-21 18:21:33,725] Trial 20 finished with value: 0.3395813486450524 and parameters: {'k_features': 28, 'iterations': 304, 'learning_rate': 0.06229762634808454, 'depth': 4, 'l2_leaf_reg': 0.37236567697045453, 'random_strength': 2.043323434185069}. Best is trial 2 with value: 0.3364305686960255.
[I 2026-06-21 18:21:38,182] Trial 21 finished with value: 0.33812236664323886 and parameters: {'k_features': 28, 'iterations': 711, 'learning_rate': 0.0072760225950910095, 'depth': 5, 'l2_leaf_reg': 3.5281779398066644, 'random_strength': 6.858667663046048}. Best is trial 2 with value: 0.3364305686960255.
[I 2026-06-21 18:21:45,113] Trial 22 finished with value: 0.33598660327413643 and parameters: {'k_features': 35, 'iterations': 769, 'learning_rate': 0.010927250094579304, 'depth': 6, 'l2_leaf_reg': 5.9313386354121205, 'random_strength': 9.817282401590639}. Best is trial 22 with value: 0.33598660327413643.
[I 2026-06-21 18:21:53,173] Trial 23 finished with value: 0.3363009958745215 and parameters: {'k_features': 41, 'iterations': 906, 'learning_rate': 0.012159652428572837, 'depth': 6, 'l2_leaf_reg': 17.357850422334447, 'random_strength': 1.5943331777536753}. Best is trial 22 with value: 0.33598660327413643.
[I 2026-06-21 18:22:06,088] Trial 24 finished with value: 0.3374479668028402 and parameters: {'k_features': 40, 'iterations': 912, 'learning_rate': 0.02349199431128682, 'depth': 7, 'l2_leaf_reg': 18.22263050347763, 'random_strength': 1.9029032125685583}. Best is trial 22 with value: 0.33598660327413643.
[I 2026-06-21 18:22:14,282] Trial 25 finished with value: 0.33632853141253816 and parameters: {'k_features': 60, 'iterations': 927, 'learning_rate': 0.010966044415475131, 'depth': 6, 'l2_leaf_reg': 7.705525823865417, 'random_strength': 0.8711201413308245}. Best is trial 22 with value: 0.33598660327413643.
[I 2026-06-21 18:22:28,190] Trial 26 finished with value: 0.3355545147767045 and parameters: {'k_features': 59, 'iterations': 892, 'learning_rate': 0.012834473306645803, 'depth': 7, 'l2_leaf_reg': 8.54361627290365, 'random_strength': 9.285137270178225}. Best is trial 26 with value: 0.3355545147767045.
[I 2026-06-21 18:23:19,898] Trial 27 finished with value: 0.3365918779800737 and parameters: {'k_features': 68, 'iterations': 875, 'learning_rate': 0.01781593789179181, 'depth': 9, 'l2_leaf_reg': 2.2886011924952943, 'random_strength': 9.590072084475704}. Best is trial 26 with value: 0.3355545147767045.
[I 2026-06-21 18:23:32,927] Trial 28 finished with value: 0.3361416501827593 and parameters: {'k_features': 54, 'iterations': 790, 'learning_rate': 0.026824649679597794, 'depth': 7, 'l2_leaf_reg': 8.763957963758516, 'random_strength': 3.367012002651386}. Best is trial 26 with value: 0.3355545147767045.
[I 2026-06-21 18:23:56,248] Trial 29 finished with value: 0.3374761241751388 and parameters: {'k_features': 56, 'iterations': 800, 'learning_rate': 0.02754399289775246, 'depth': 8, 'l2_leaf_reg': 6.826780565366473, 'random_strength': 3.3836795358081884}. Best is trial 26 with value: 0.3355545147767045.
[I 2026-06-21 18:24:43,373] Trial 30 finished with value: 0.33990527623758227 and parameters: {'k_features': 73, 'iterations': 799, 'learning_rate': 0.061189568028393954, 'depth': 9, 'l2_leaf_reg': 9.483521563570369, 'random_strength': 4.402722880923097}. Best is trial 26 with value: 0.3355545147767045.
[I 2026-06-21 18:24:57,553] Trial 31 finished with value: 0.3348684549994425 and parameters: {'k_features': 44, 'iterations': 899, 'learning_rate': 0.012922266833626508, 'depth': 7, 'l2_leaf_reg': 2.018415790802102, 'random_strength': 8.082648935560762}. Best is trial 31 with value: 0.3348684549994425.
[I 2026-06-21 18:25:09,861] Trial 32 finished with value: 0.3344251392550983 and parameters: {'k_features': 45, 'iterations': 775, 'learning_rate': 0.017161107885754336, 'depth': 7, 'l2_leaf_reg': 1.909101778238816, 'random_strength': 8.045039121498192}. Best is trial 32 with value: 0.3344251392550983.
[I 2026-06-21 18:25:24,841] Trial 33 finished with value: 0.3359370034340245 and parameters: {'k_features': 45, 'iterations': 951, 'learning_rate': 0.017519217893075083, 'depth': 7, 'l2_leaf_reg': 1.733424323558007, 'random_strength': 9.97109049652241}. Best is trial 32 with value: 0.3344251392550983.
[I 2026-06-21 18:25:52,486] Trial 34 finished with value: 0.3366684245325969 and parameters: {'k_features': 45, 'iterations': 959, 'learning_rate': 0.017104795729159166, 'depth': 8, 'l2_leaf_reg': 2.0590626933747753, 'random_strength': 5.325568972617294}. Best is trial 32 with value: 0.3344251392550983.
[I 2026-06-21 18:26:06,011] Trial 35 finished with value: 0.34837735866204156 and parameters: {'k_features': 43, 'iterations': 857, 'learning_rate': 0.1461586040713424, 'depth': 7, 'l2_leaf_reg': 1.4601512287992329, 'random_strength': 9.829366882533751}. Best is trial 32 with value: 0.3344251392550983.
[I 2026-06-21 18:28:30,780] Trial 36 finished with value: 0.33818956239167514 and parameters: {'k_features': 48, 'iterations': 993, 'learning_rate': 0.016025924475998536, 'depth': 10, 'l2_leaf_reg': 4.050978270022554, 'random_strength': 1.2932355256495407}. Best is trial 32 with value: 0.3344251392550983.
[I 2026-06-21 18:29:21,360] Trial 37 finished with value: 0.338965673834205 and parameters: {'k_features': 65, 'iterations': 862, 'learning_rate': 0.021031144752242898, 'depth': 9, 'l2_leaf_reg': 0.6627895725004309, 'random_strength': 2.6856920035672225}. Best is trial 32 with value: 0.3344251392550983.
[I 2026-06-21 18:29:36,456] Trial 38 finished with value: 0.33538641872997765 and parameters: {'k_features': 57, 'iterations': 926, 'learning_rate': 0.013541692269181787, 'depth': 7, 'l2_leaf_reg': 1.6009563234575737, 'random_strength': 6.137890165323233}. Best is trial 32 with value: 0.3344251392550983.
[I 2026-06-21 18:30:01,817] Trial 39 finished with value: 0.3356137046804124 and parameters: {'k_features': 57, 'iterations': 879, 'learning_rate': 0.013409410401038987, 'depth': 8, 'l2_leaf_reg': 4.12111049044033, 'random_strength': 5.209523451933595}. Best is trial 32 with value: 0.3344251392550983.
[I 2026-06-21 18:30:04,358] Trial 40 finished with value: 0.34617680211584956 and parameters: {'k_features': 99, 'iterations': 125, 'learning_rate': 0.00679586899559614, 'depth': 7, 'l2_leaf_reg': 0.49214946924040104, 'random_strength': 2.7515900824887685}. Best is trial 32 with value: 0.3344251392550983.
[I 2026-06-21 18:30:30,979] Trial 41 finished with value: 0.33592771696922374 and parameters: {'k_features': 56, 'iterations': 903, 'learning_rate': 0.013475363487645251, 'depth': 8, 'l2_leaf_reg': 3.8801107178894974, 'random_strength': 5.418810372164562}. Best is trial 32 with value: 0.3344251392550983.
[I 2026-06-21 18:30:55,148] Trial 42 finished with value: 0.3348711252475827 and parameters: {'k_features': 68, 'iterations': 840, 'learning_rate': 0.012710224081064973, 'depth': 8, 'l2_leaf_reg': 2.415893445068073, 'random_strength': 6.089503794643694}. Best is trial 32 with value: 0.3344251392550983.
[I 2026-06-21 18:31:08,340] Trial 43 finished with value: 0.3390783744366992 and parameters: {'k_features': 88, 'iterations': 838, 'learning_rate': 0.02097517584169782, 'depth': 7, 'l2_leaf_reg': 0.9752438599432315, 'random_strength': 1.3449722904023604}. Best is trial 32 with value: 0.3344251392550983.
[I 2026-06-21 18:31:47,637] Trial 44 finished with value: 0.33573906740458825 and parameters: {'k_features': 72, 'iterations': 652, 'learning_rate': 0.014147719125206395, 'depth': 9, 'l2_leaf_reg': 2.7184406078132266, 'random_strength': 3.6340129590107106}. Best is trial 32 with value: 0.3344251392550983.
[I 2026-06-21 18:32:11,502] Trial 45 finished with value: 0.3359010577348388 and parameters: {'k_features': 68, 'iterations': 819, 'learning_rate': 0.012066637036903227, 'depth': 8, 'l2_leaf_reg': 11.827547441876703, 'random_strength': 6.8443710046494095}. Best is trial 32 with value: 0.3344251392550983.
[I 2026-06-21 18:32:23,684] Trial 46 finished with value: 0.3383938363028461 and parameters: {'k_features': 77, 'iterations': 750, 'learning_rate': 0.015113862869264328, 'depth': 7, 'l2_leaf_reg': 0.2241811162033431, 'random_strength': 0.6334651715859236}. Best is trial 32 with value: 0.3344251392550983.
[I 2026-06-21 18:32:30,781] Trial 47 finished with value: 0.336224505610192 and parameters: {'k_features': 51, 'iterations': 654, 'learning_rate': 0.009804289335577821, 'depth': 6, 'l2_leaf_reg': 1.6296464507275261, 'random_strength': 6.685450279339313}. Best is trial 32 with value: 0.3344251392550983.
[I 2026-06-21 18:32:44,040] Trial 48 finished with value: 0.33670041506848397 and parameters: {'k_features': 82, 'iterations': 742, 'learning_rate': 0.007361581435670013, 'depth': 7, 'l2_leaf_reg': 5.404467537244902, 'random_strength': 2.411016446372202}. Best is trial 32 with value: 0.3344251392550983.
[I 2026-06-21 18:33:11,355] Trial 49 finished with value: 0.3414337853874915 and parameters: {'k_features': 37, 'iterations': 944, 'learning_rate': 0.03444722807204465, 'depth': 8, 'l2_leaf_reg': 0.0011267588134749884, 'random_strength': 3.9689414134496492}. Best is trial 32 with value: 0.3344251392550983.
[I 2026-06-21 18:33:14,210] A new study created in memory with name: random_forest_tuning
[I 2026-06-21 18:33:17,643] Trial 0 finished with value: 0.34321452667384633 and parameters: {'k_features': 14, 'n_estimators': 541, 'max_depth': 22, 'min_samples_split': 20, 'min_samples_leaf': 12, 'max_features': 0.525535214575814}. Best is trial 0 with value: 0.34321452667384633.
[I 2026-06-21 18:33:20,372] Trial 1 finished with value: 0.33758163178166745 and parameters: {'k_features': 79, 'n_estimators': 356, 'max_depth': 15, 'min_samples_split': 9, 'min_samples_leaf': 18, 'max_features': 0.641659850722498}. Best is trial 1 with value: 0.33758163178166745.
[I 2026-06-21 18:33:25,392] Trial 2 finished with value: 0.33878871417667483 and parameters: {'k_features': 65, 'n_estimators': 680, 'max_depth': 18, 'min_samples_split': 17, 'min_samples_leaf': 4, 'max_features': 0.6183390651484264}. Best is trial 1 with value: 0.33758163178166745.
[I 2026-06-21 18:33:29,411] Trial 3 finished with value: 0.33999797587991176 and parameters: {'k_features': 18, 'n_estimators': 628, 'max_depth': 13, 'min_samples_split': 8, 'min_samples_leaf': 18, 'max_features': 0.4776482706674014}. Best is trial 1 with value: 0.33758163178166745.
[I 2026-06-21 18:33:32,618] Trial 4 finished with value: 0.3417743517979475 and parameters: {'k_features': 17, 'n_estimators': 455, 'max_depth': 3, 'min_samples_split': 21, 'min_samples_leaf': 6, 'max_features': 0.830500451961532}. Best is trial 1 with value: 0.33758163178166745.
[I 2026-06-21 18:33:36,877] Trial 5 finished with value: 0.33833150561814695 and parameters: {'k_features': 21, 'n_estimators': 667, 'max_depth': 5, 'min_samples_split': 18, 'min_samples_leaf': 6, 'max_features': 0.7061532692187271}. Best is trial 1 with value: 0.33758163178166745.
[I 2026-06-21 18:33:40,078] Trial 6 finished with value: 0.33901830684321815 and parameters: {'k_features': 56, 'n_estimators': 348, 'max_depth': 15, 'min_samples_split': 5, 'min_samples_leaf': 6, 'max_features': 0.8665049180986029}. Best is trial 1 with value: 0.33758163178166745.
[I 2026-06-21 18:33:43,087] Trial 7 finished with value: 0.33749730867260713 and parameters: {'k_features': 31, 'n_estimators': 387, 'max_depth': 20, 'min_samples_split': 2, 'min_samples_leaf': 9, 'max_features': 0.6594488499503348}. Best is trial 7 with value: 0.33749730867260713.
[I 2026-06-21 18:33:44,508] Trial 8 finished with value: 0.3377132792036374 and parameters: {'k_features': 26, 'n_estimators': 122, 'max_depth': 20, 'min_samples_split': 29, 'min_samples_leaf': 11, 'max_features': 0.7775413222214247}. Best is trial 7 with value: 0.33749730867260713.
[I 2026-06-21 18:33:46,258] Trial 9 finished with value: 0.33736830169510007 and parameters: {'k_features': 59, 'n_estimators': 176, 'max_depth': 24, 'min_samples_split': 8, 'min_samples_leaf': 13, 'max_features': 0.7200168769292359}. Best is trial 9 with value: 0.33736830169510007.
[I 2026-06-21 18:33:47,738] Trial 10 finished with value: 0.3388461508257943 and parameters: {'k_features': 98, 'n_estimators': 107, 'max_depth': 30, 'min_samples_split': 30, 'min_samples_leaf': 14, 'max_features': 0.9601572307870968}. Best is trial 9 with value: 0.33736830169510007.
[I 2026-06-21 18:33:49,884] Trial 11 finished with value: 0.3377689848707537 and parameters: {'k_features': 42, 'n_estimators': 244, 'max_depth': 26, 'min_samples_split': 2, 'min_samples_leaf': 9, 'max_features': 0.6017589538834726}. Best is trial 9 with value: 0.33736830169510007.
[I 2026-06-21 18:33:51,763] Trial 12 finished with value: 0.33711038692429274 and parameters: {'k_features': 43, 'n_estimators': 247, 'max_depth': 26, 'min_samples_split': 12, 'min_samples_leaf': 15, 'max_features': 0.4027140011149022}. Best is trial 12 with value: 0.33711038692429274.
[I 2026-06-21 18:33:53,586] Trial 13 finished with value: 0.3363638140844673 and parameters: {'k_features': 48, 'n_estimators': 226, 'max_depth': 26, 'min_samples_split': 12, 'min_samples_leaf': 15, 'max_features': 0.41077537463386654}. Best is trial 13 with value: 0.3363638140844673.
[I 2026-06-21 18:33:55,512] Trial 14 finished with value: 0.33709741277114313 and parameters: {'k_features': 41, 'n_estimators': 254, 'max_depth': 29, 'min_samples_split': 13, 'min_samples_leaf': 16, 'max_features': 0.41489314492221646}. Best is trial 13 with value: 0.3363638140844673.
[I 2026-06-21 18:33:57,363] Trial 15 finished with value: 0.3371134781236774 and parameters: {'k_features': 39, 'n_estimators': 242, 'max_depth': 29, 'min_samples_split': 14, 'min_samples_leaf': 20, 'max_features': 0.40680292225389386}. Best is trial 13 with value: 0.3363638140844673.
[I 2026-06-21 18:33:59,622] Trial 16 finished with value: 0.33709861189869095 and parameters: {'k_features': 70, 'n_estimators': 296, 'max_depth': 28, 'min_samples_split': 14, 'min_samples_leaf': 17, 'max_features': 0.5124307878681132}. Best is trial 13 with value: 0.3363638140844673.
[I 2026-06-21 18:34:04,616] Trial 17 finished with value: 0.33687123855813117 and parameters: {'k_features': 49, 'n_estimators': 792, 'max_depth': 24, 'min_samples_split': 24, 'min_samples_leaf': 16, 'max_features': 0.44344408203060015}. Best is trial 13 with value: 0.3363638140844673.
[I 2026-06-21 18:34:10,332] Trial 18 finished with value: 0.35202339154414686 and parameters: {'k_features': 6, 'n_estimators': 782, 'max_depth': 9, 'min_samples_split': 25, 'min_samples_leaf': 20, 'max_features': 0.48321935065465915}. Best is trial 13 with value: 0.3363638140844673.
[I 2026-06-21 18:34:13,706] Trial 19 finished with value: 0.3401982641635054 and parameters: {'k_features': 52, 'n_estimators': 495, 'max_depth': 24, 'min_samples_split': 25, 'min_samples_leaf': 1, 'max_features': 0.559533176172798}. Best is trial 13 with value: 0.3363638140844673.
[I 2026-06-21 18:34:18,576] Trial 20 finished with value: 0.3366460273826563 and parameters: {'k_features': 83, 'n_estimators': 785, 'max_depth': 23, 'min_samples_split': 25, 'min_samples_leaf': 11, 'max_features': 0.45873415331610934}. Best is trial 13 with value: 0.3363638140844673.
[I 2026-06-21 18:34:23,648] Trial 21 finished with value: 0.33691468348418985 and parameters: {'k_features': 85, 'n_estimators': 787, 'max_depth': 23, 'min_samples_split': 24, 'min_samples_leaf': 10, 'max_features': 0.46398956362886684}. Best is trial 13 with value: 0.3363638140844673.
[I 2026-06-21 18:34:28,707] Trial 22 finished with value: 0.3370253452862963 and parameters: {'k_features': 97, 'n_estimators': 744, 'max_depth': 26, 'min_samples_split': 27, 'min_samples_leaf': 14, 'max_features': 0.5662503474653188}. Best is trial 13 with value: 0.3363638140844673.
[I 2026-06-21 18:34:32,628] Trial 23 finished with value: 0.3369042268548891 and parameters: {'k_features': 76, 'n_estimators': 581, 'max_depth': 20, 'min_samples_split': 22, 'min_samples_leaf': 12, 'max_features': 0.45796638599000267}. Best is trial 13 with value: 0.3363638140844673.
