[I 2026-06-21 18:37:29,197] Trial 34 finished with value: 0.3371815557259182 and parameters: {'k_features': 28, 'n_estimators': 428, 'learning_rate': 0.01025718295598188, 'max_depth': 3, 'min_child_weight': 0.0349374848802619, 'subsample': 0.6297722950650901, 'colsample_bytree': 0.6861702133650778, 'reg_alpha': 1.068327894017829e-06, 'reg_lambda': 1.069307424515461}. Best is trial 34 with value: 0.3371815557259182.
[I 2026-06-21 18:37:30,356] Trial 35 finished with value: 0.33875161574516716 and parameters: {'k_features': 23, 'n_estimators': 287, 'learning_rate': 0.006953828406153287, 'max_depth': 3, 'min_child_weight': 0.06474849564277266, 'subsample': 0.6262259496722894, 'colsample_bytree': 0.7071070184310264, 'reg_alpha': 5.111309270875542e-05, 'reg_lambda': 0.7909890703639922}. Best is trial 34 with value: 0.3371815557259182.
[I 2026-06-21 18:37:31,279] Trial 36 finished with value: 0.3529804199539668 and parameters: {'k_features': 5, 'n_estimators': 167, 'learning_rate': 0.00975388294451637, 'max_depth': 3, 'min_child_weight': 0.015185997752220931, 'subsample': 0.6738165553420764, 'colsample_bytree': 0.9202228451592146, 'reg_alpha': 0.00021727838125235122, 'reg_lambda': 1.9063797915299124e-08}. Best is trial 34 with value: 0.3371815557259182.
[I 2026-06-21 18:37:33,051] Trial 37 finished with value: 0.3545834430235059 and parameters: {'k_features': 48, 'n_estimators': 528, 'learning_rate': 0.0748840299584278, 'max_depth': 4, 'min_child_weight': 0.13574440313832897, 'subsample': 0.6301213360135743, 'colsample_bytree': 0.6302924176938942, 'reg_alpha': 4.64724205073378e-08, 'reg_lambda': 0.0017790243871532978}. Best is trial 34 with value: 0.3371815557259182.
[I 2026-06-21 18:37:35,149] Trial 38 finished with value: 0.34420862817391423 and parameters: {'k_features': 16, 'n_estimators': 341, 'learning_rate': 0.011034874881515826, 'max_depth': 5, 'min_child_weight': 0.023519529733322962, 'subsample': 0.7615976634643874, 'colsample_bytree': 0.7749756120382406, 'reg_alpha': 8.249075632488452e-06, 'reg_lambda': 0.14945498510431277}. Best is trial 34 with value: 0.3371815557259182.
[I 2026-06-21 18:37:37,191] Trial 39 finished with value: 0.33614345486250236 and parameters: {'k_features': 30, 'n_estimators': 731, 'learning_rate': 0.005849257658284365, 'max_depth': 3, 'min_child_weight': 0.07601078005616878, 'subsample': 0.7815659067124829, 'colsample_bytree': 0.7274559272092436, 'reg_alpha': 0.0015321517080958528, 'reg_lambda': 8.153822949921105}. Best is trial 39 with value: 0.33614345486250236.
[I 2026-06-21 18:37:40,486] Trial 40 finished with value: 0.3369153416836627 and parameters: {'k_features': 65, 'n_estimators': 976, 'learning_rate': 0.008076282708519929, 'max_depth': 4, 'min_child_weight': 0.08085037839530974, 'subsample': 0.8336071218426337, 'colsample_bytree': 0.7268772449101806, 'reg_alpha': 0.0015917948473455476, 'reg_lambda': 9.999274970284754}. Best is trial 39 with value: 0.33614345486250236.
[I 2026-06-21 18:37:43,321] Trial 41 finished with value: 0.33761536119751484 and parameters: {'k_features': 90, 'n_estimators': 995, 'learning_rate': 0.006043459274653738, 'max_depth': 4, 'min_child_weight': 0.06874979300692444, 'subsample': 0.8525493430633672, 'colsample_bytree': 0.7283589992459557, 'reg_alpha': 0.0026858878003002667, 'reg_lambda': 9.811989457677946}. Best is trial 39 with value: 0.33614345486250236.
[I 2026-06-21 18:37:48,920] Trial 42 finished with value: 0.33799637341828326 and parameters: {'k_features': 98, 'n_estimators': 1000, 'learning_rate': 0.0060998674816893335, 'max_depth': 6, 'min_child_weight': 0.08186301682568868, 'subsample': 0.8350856303549468, 'colsample_bytree': 0.7325039437607714, 'reg_alpha': 0.0028938013857091782, 'reg_lambda': 8.621042198834312}. Best is trial 39 with value: 0.33614345486250236.
[I 2026-06-21 18:37:51,660] Trial 43 finished with value: 0.33840859943225793 and parameters: {'k_features': 90, 'n_estimators': 938, 'learning_rate': 0.008097222239316835, 'max_depth': 4, 'min_child_weight': 0.1646424447275047, 'subsample': 0.8715148394246741, 'colsample_bytree': 0.7547808788925034, 'reg_alpha': 0.14916517168860333, 'reg_lambda': 2.583056373802917}. Best is trial 39 with value: 0.33614345486250236.
[I 2026-06-21 18:37:55,188] Trial 44 finished with value: 0.3373292808913703 and parameters: {'k_features': 61, 'n_estimators': 940, 'learning_rate': 0.0059184652941176915, 'max_depth': 5, 'min_child_weight': 0.12236712487066054, 'subsample': 0.8002079995646083, 'colsample_bytree': 0.7218764136945321, 'reg_alpha': 0.13579169387182038, 'reg_lambda': 0.9785466578489982}. Best is trial 39 with value: 0.33614345486250236.
[I 2026-06-21 18:38:00,188] Trial 45 finished with value: 0.33679560208415055 and parameters: {'k_features': 65, 'n_estimators': 843, 'learning_rate': 0.005901349029170662, 'max_depth': 6, 'min_child_weight': 0.2780918266889762, 'subsample': 0.7901427604121817, 'colsample_bytree': 0.8239815604146676, 'reg_alpha': 2.2375882724168776, 'reg_lambda': 0.6913661443453488}. Best is trial 39 with value: 0.33614345486250236.
[I 2026-06-21 18:38:04,613] Trial 46 finished with value: 0.3369359513020959 and parameters: {'k_features': 63, 'n_estimators': 799, 'learning_rate': 0.005084851306550085, 'max_depth': 6, 'min_child_weight': 0.2429586881244208, 'subsample': 0.7945504702090953, 'colsample_bytree': 0.7153154116714641, 'reg_alpha': 1.2207640224932077, 'reg_lambda': 1.1606157231196448}. Best is trial 39 with value: 0.33614345486250236.
[I 2026-06-21 18:38:08,065] Trial 47 finished with value: 0.33740800746201494 and parameters: {'k_features': 67, 'n_estimators': 770, 'learning_rate': 0.005046808852187591, 'max_depth': 6, 'min_child_weight': 0.8396749398353477, 'subsample': 0.779717239357459, 'colsample_bytree': 0.8298390274569917, 'reg_alpha': 5.596280288115075, 'reg_lambda': 0.5602173782382599}. Best is trial 39 with value: 0.33614345486250236.
[I 2026-06-21 18:38:17,523] Trial 48 finished with value: 0.3390893097823544 and parameters: {'k_features': 72, 'n_estimators': 844, 'learning_rate': 0.007770349009779045, 'max_depth': 8, 'min_child_weight': 0.33712854225315947, 'subsample': 0.8200167922170185, 'colsample_bytree': 0.8988086274058809, 'reg_alpha': 0.8870116844499285, 'reg_lambda': 2.2434677925338478}. Best is trial 39 with value: 0.33614345486250236.
[I 2026-06-21 18:38:23,363] Trial 49 finished with value: 0.3373823760476378 and parameters: {'k_features': 62, 'n_estimators': 823, 'learning_rate': 0.006318976306942807, 'max_depth': 7, 'min_child_weight': 1.3234094119527289, 'subsample': 0.7860937283470614, 'colsample_bytree': 0.7517844118289077, 'reg_alpha': 1.6410318055690163, 'reg_lambda': 3.752418068169059}. Best is trial 39 with value: 0.33614345486250236.
[I 2026-06-21 18:38:24,121] A new study created in memory with name: mlp_tuning
[I 2026-06-21 18:38:24,994] Trial 0 finished with value: 0.35748396700046126 and parameters: {'k_features': 58, 'hidden_layer_sizes': (64,), 'activation': 'relu', 'alpha': 6.532799354947315e-06, 'learning_rate_init': 0.0036506138935743677, 'batch_size': 64}. Best is trial 0 with value: 0.35748396700046126.
[I 2026-06-21 18:38:26,761] Trial 1 finished with value: 0.3395485770785599 and parameters: {'k_features': 22, 'hidden_layer_sizes': (128, 64), 'activation': 'tanh', 'alpha': 0.0014021925314583895, 'learning_rate_init': 0.0004463533328535128, 'batch_size': 64}. Best is trial 1 with value: 0.3395485770785599.
[I 2026-06-21 18:38:27,880] Trial 2 finished with value: 0.35467630331433825 and parameters: {'k_features': 6, 'hidden_layer_sizes': (32,), 'activation': 'tanh', 'alpha': 0.0012691297552160433, 'learning_rate_init': 0.0008577816488388881, 'batch_size': 32}. Best is trial 1 with value: 0.3395485770785599.
[I 2026-06-21 18:38:34,073] Trial 3 finished with value: 0.35621447235787407 and parameters: {'k_features': 10, 'hidden_layer_sizes': (128, 64, 32), 'activation': 'relu', 'alpha': 3.217897371762882e-05, 'learning_rate_init': 0.00013504881491335812, 'batch_size': 16}. Best is trial 1 with value: 0.3395485770785599.
[I 2026-06-21 18:38:35,945] Trial 4 finished with value: 0.36917101302782135 and parameters: {'k_features': 27, 'hidden_layer_sizes': (64,), 'activation': 'relu', 'alpha': 0.008080783310773876, 'learning_rate_init': 0.00025555246628822443, 'batch_size': 128}. Best is trial 1 with value: 0.3395485770785599.
[I 2026-06-21 18:38:37,763] Trial 5 finished with value: 0.3612201452926155 and parameters: {'k_features': 18, 'hidden_layer_sizes': (128, 64, 32), 'activation': 'tanh', 'alpha': 0.0002206037722622274, 'learning_rate_init': 0.0009825422933170738, 'batch_size': 128}. Best is trial 1 with value: 0.3395485770785599.
[I 2026-06-21 18:38:40,545] Trial 6 finished with value: 0.35682862410015265 and parameters: {'k_features': 6, 'hidden_layer_sizes': (128, 64), 'activation': 'relu', 'alpha': 8.927435082876635e-06, 'learning_rate_init': 0.0001947222921006216, 'batch_size': 32}. Best is trial 1 with value: 0.3395485770785599.
[I 2026-06-21 18:38:41,946] Trial 7 finished with value: 0.3574755311901838 and parameters: {'k_features': 60, 'hidden_layer_sizes': (64,), 'activation': 'tanh', 'alpha': 3.2578012673963637e-05, 'learning_rate_init': 0.00024910886575395074, 'batch_size': 128}. Best is trial 1 with value: 0.3395485770785599.
[I 2026-06-21 18:38:43,072] Trial 8 finished with value: 0.3639637512605884 and parameters: {'k_features': 91, 'hidden_layer_sizes': (128,), 'activation': 'relu', 'alpha': 9.39531220385108e-06, 'learning_rate_init': 0.009065403198685578, 'batch_size': 128}. Best is trial 1 with value: 0.3395485770785599.
[I 2026-06-21 18:38:46,508] Trial 9 finished with value: 0.35182535950688265 and parameters: {'k_features': 54, 'hidden_layer_sizes': (64,), 'activation': 'relu', 'alpha': 1.7260544120124703e-06, 'learning_rate_init': 0.0001785227704225398, 'batch_size': 16}. Best is trial 1 with value: 0.3395485770785599.
[I 2026-06-21 18:38:48,414] Trial 10 finished with value: 0.34595450945950046 and parameters: {'k_features': 96, 'hidden_layer_sizes': (128, 64), 'activation': 'tanh', 'alpha': 0.007089568874509959, 'learning_rate_init': 0.0010717660442052931, 'batch_size': 64}. Best is trial 1 with value: 0.3395485770785599.
[I 2026-06-21 18:38:50,453] Trial 11 finished with value: 0.33980041170301245 and parameters: {'k_features': 97, 'hidden_layer_sizes': (128, 64), 'activation': 'tanh', 'alpha': 0.008323723023098988, 'learning_rate_init': 0.0007890121948631531, 'batch_size': 64}. Best is trial 1 with value: 0.3395485770785599.
[I 2026-06-21 18:38:51,914] Trial 12 finished with value: 0.3398045544314702 and parameters: {'k_features': 38, 'hidden_layer_sizes': (128, 64), 'activation': 'tanh', 'alpha': 0.001146552999014048, 'learning_rate_init': 0.00047187171547875, 'batch_size': 64}. Best is trial 1 with value: 0.3395485770785599.
[I 2026-06-21 18:38:52,928] Trial 13 finished with value: 0.35264209853632883 and parameters: {'k_features': 78, 'hidden_layer_sizes': (64, 32), 'activation': 'tanh', 'alpha': 0.001140309303612287, 'learning_rate_init': 0.0020752060633048948, 'batch_size': 64}. Best is trial 1 with value: 0.3395485770785599.
[I 2026-06-21 18:38:54,638] Trial 14 finished with value: 0.33988060390820873 and parameters: {'k_features': 77, 'hidden_layer_sizes': (128, 64), 'activation': 'tanh', 'alpha': 0.00310701804577082, 'learning_rate_init': 0.0004825052900366871, 'batch_size': 64}. Best is trial 1 with value: 0.3395485770785599.
[I 2026-06-21 18:38:56,495] Trial 15 finished with value: 0.3401811208145452 and parameters: {'k_features': 38, 'hidden_layer_sizes': (128, 64), 'activation': 'tanh', 'alpha': 0.0002523020187588555, 'learning_rate_init': 0.0005040138423142415, 'batch_size': 64}. Best is trial 1 with value: 0.3395485770785599.
[I 2026-06-21 18:38:57,777] Trial 16 finished with value: 0.35271207489291756 and parameters: {'k_features': 78, 'hidden_layer_sizes': (64, 32), 'activation': 'tanh', 'alpha': 0.00023882953847489366, 'learning_rate_init': 0.002166353983454797, 'batch_size': 64}. Best is trial 1 with value: 0.3395485770785599.
[I 2026-06-21 18:38:58,961] Trial 17 finished with value: 0.3490038767073721 and parameters: {'k_features': 41, 'hidden_layer_sizes': (128,), 'activation': 'tanh', 'alpha': 0.003055254651678784, 'learning_rate_init': 0.0016928203471738904, 'batch_size': 64}. Best is trial 1 with value: 0.3395485770785599.
[I 2026-06-21 18:39:01,600] Trial 18 finished with value: 0.3526707765436813 and parameters: {'k_features': 48, 'hidden_layer_sizes': (32,), 'activation': 'tanh', 'alpha': 0.0004425980213982878, 'learning_rate_init': 0.00041978852941051183, 'batch_size': 16}. Best is trial 1 with value: 0.3395485770785599.
[I 2026-06-21 18:39:04,522] Trial 19 finished with value: 0.3384153299363748 and parameters: {'k_features': 67, 'hidden_layer_sizes': (128, 64), 'activation': 'tanh', 'alpha': 0.0027545752922721817, 'learning_rate_init': 0.00010818634280915451, 'batch_size': 32}. Best is trial 19 with value: 0.3384153299363748.
[I 2026-06-21 18:39:06,896] Trial 20 finished with value: 0.33833039707523105 and parameters: {'k_features': 68, 'hidden_layer_sizes': (128, 64), 'activation': 'tanh', 'alpha': 9.380347582290287e-05, 'learning_rate_init': 0.00011328044407764346, 'batch_size': 32}. Best is trial 20 with value: 0.33833039707523105.
[I 2026-06-21 18:39:09,404] Trial 21 finished with value: 0.3385254256074973 and parameters: {'k_features': 68, 'hidden_layer_sizes': (128, 64), 'activation': 'tanh', 'alpha': 6.087270249126428e-05, 'learning_rate_init': 0.00010554429918126496, 'batch_size': 32}. Best is trial 20 with value: 0.33833039707523105.
[I 2026-06-21 18:39:12,075] Trial 22 finished with value: 0.3386649353203087 and parameters: {'k_features': 67, 'hidden_layer_sizes': (128, 64), 'activation': 'tanh', 'alpha': 8.38506254645377e-05, 'learning_rate_init': 0.00010074045447577044, 'batch_size': 32}. Best is trial 20 with value: 0.33833039707523105.
[I 2026-06-21 18:39:14,696] Trial 23 finished with value: 0.3385631405072894 and parameters: {'k_features': 69, 'hidden_layer_sizes': (128, 64), 'activation': 'tanh', 'alpha': 6.056104479730441e-05, 'learning_rate_init': 0.00010419695756800498, 'batch_size': 32}. Best is trial 20 with value: 0.33833039707523105.
[I 2026-06-21 18:39:17,412] Trial 24 finished with value: 0.338280405335676 and parameters: {'k_features': 85, 'hidden_layer_sizes': (128, 64), 'activation': 'tanh', 'alpha': 8.803508871706335e-05, 'learning_rate_init': 0.00014883182442489476, 'batch_size': 32}. Best is trial 24 with value: 0.338280405335676.
[I 2026-06-21 18:39:19,876] Trial 25 finished with value: 0.3392477423206085 and parameters: {'k_features': 86, 'hidden_layer_sizes': (128, 64), 'activation': 'tanh', 'alpha': 0.0005131242677687529, 'learning_rate_init': 0.00028282488137326554, 'batch_size': 32}. Best is trial 24 with value: 0.338280405335676.
[I 2026-06-21 18:39:22,781] Trial 26 finished with value: 0.35159070513172974 and parameters: {'k_features': 85, 'hidden_layer_sizes': (64, 32), 'activation': 'tanh', 'alpha': 0.00011410503353058761, 'learning_rate_init': 0.0001674203522547207, 'batch_size': 32}. Best is trial 24 with value: 0.338280405335676.
[I 2026-06-21 18:39:25,464] Trial 27 finished with value: 0.35657059316078243 and parameters: {'k_features': 72, 'hidden_layer_sizes': (32,), 'activation': 'tanh', 'alpha': 2.6674103243185007e-05, 'learning_rate_init': 0.000148563257912802, 'batch_size': 32}. Best is trial 24 with value: 0.338280405335676.
[I 2026-06-21 18:39:27,195] Trial 28 finished with value: 0.34598279669518306 and parameters: {'k_features': 84, 'hidden_layer_sizes': (128,), 'activation': 'tanh', 'alpha': 2.6806781151562737e-06, 'learning_rate_init': 0.00028398321994130266, 'batch_size': 32}. Best is trial 24 with value: 0.338280405335676.
[I 2026-06-21 18:39:29,991] Trial 29 finished with value: 0.35355079626837543 and parameters: {'k_features': 61, 'hidden_layer_sizes': (128, 64, 32), 'activation': 'relu', 'alpha': 4.310796453384076e-06, 'learning_rate_init': 0.00021740805319348324, 'batch_size': 32}. Best is trial 24 with value: 0.338280405335676.
[I 2026-06-21 18:39:32,417] Trial 30 finished with value: 0.33837118602069666 and parameters: {'k_features': 62, 'hidden_layer_sizes': (128, 64), 'activation': 'tanh', 'alpha': 1.7300239488420415e-05, 'learning_rate_init': 0.00013709929923983827, 'batch_size': 32}. Best is trial 24 with value: 0.338280405335676.
[I 2026-06-21 18:39:34,830] Trial 31 finished with value: 0.3384156085769811 and parameters: {'k_features': 53, 'hidden_layer_sizes': (128, 64), 'activation': 'tanh', 'alpha': 1.557002992111585e-05, 'learning_rate_init': 0.00013232181120883036, 'batch_size': 32}. Best is trial 24 with value: 0.338280405335676.
[I 2026-06-21 18:39:36,901] Trial 32 finished with value: 0.3406019241738053 and parameters: {'k_features': 62, 'hidden_layer_sizes': (128, 64), 'activation': 'tanh', 'alpha': 1.7844546642355307e-05, 'learning_rate_init': 0.0003491758607389121, 'batch_size': 32}. Best is trial 24 with value: 0.338280405335676.
[I 2026-06-21 18:39:39,366] Trial 33 finished with value: 0.3383308012098429 and parameters: {'k_features': 73, 'hidden_layer_sizes': (128, 64), 'activation': 'tanh', 'alpha': 0.00012817058167958713, 'learning_rate_init': 0.00014174080890866152, 'batch_size': 32}. Best is trial 24 with value: 0.338280405335676.
[I 2026-06-21 18:39:41,886] Trial 34 finished with value: 0.33827667972771047 and parameters: {'k_features': 74, 'hidden_layer_sizes': (128, 64), 'activation': 'tanh', 'alpha': 0.0001547292856405897, 'learning_rate_init': 0.00014920975763056655, 'batch_size': 32}. Best is trial 34 with value: 0.33827667972771047.
[I 2026-06-21 18:39:44,092] Trial 35 finished with value: 0.33778827059839334 and parameters: {'k_features': 90, 'hidden_layer_sizes': (128, 64), 'activation': 'tanh', 'alpha': 0.00012507414911984278, 'learning_rate_init': 0.00017852587862777976, 'batch_size': 32}. Best is trial 35 with value: 0.33778827059839334.
[I 2026-06-21 18:39:47,255] Trial 36 finished with value: 0.35292371459834715 and parameters: {'k_features': 100, 'hidden_layer_sizes': (128, 64, 32), 'activation': 'relu', 'alpha': 0.00047479782100893613, 'learning_rate_init': 0.00020165822162360886, 'batch_size': 16}. Best is trial 35 with value: 0.33778827059839334.
[I 2026-06-21 18:39:49,409] Trial 37 finished with value: 0.354724676951456 and parameters: {'k_features': 89, 'hidden_layer_sizes': (32,), 'activation': 'tanh', 'alpha': 4.2390026823276665e-05, 'learning_rate_init': 0.0003011232560408166, 'batch_size': 32}. Best is trial 35 with value: 0.33778827059839334.
[I 2026-06-21 18:39:51,786] Trial 38 finished with value: 0.3500853635829365 and parameters: {'k_features': 93, 'hidden_layer_sizes': (64,), 'activation': 'tanh', 'alpha': 0.00014189454135033882, 'learning_rate_init': 0.00020028511617106877, 'batch_size': 32}. Best is trial 35 with value: 0.33778827059839334.
[I 2026-06-21 18:39:53,288] Trial 39 finished with value: 0.35348549476192925 and parameters: {'k_features': 81, 'hidden_layer_sizes': (128, 64), 'activation': 'relu', 'alpha': 0.00018450116874695806, 'learning_rate_init': 0.0006671889704097031, 'batch_size': 128}. Best is trial 35 with value: 0.33778827059839334.
[I 2026-06-21 18:39:54,839] Trial 40 finished with value: 0.3600304259925848 and parameters: {'k_features': 75, 'hidden_layer_sizes': (128, 64), 'activation': 'tanh', 'alpha': 0.00037806886454526525, 'learning_rate_init': 0.00895563717491896, 'batch_size': 32}. Best is trial 35 with value: 0.33778827059839334.
[I 2026-06-21 18:39:57,244] Trial 41 finished with value: 0.33835415527955165 and parameters: {'k_features': 73, 'hidden_layer_sizes': (128, 64), 'activation': 'tanh', 'alpha': 8.316229983765053e-05, 'learning_rate_init': 0.00013895606611681155, 'batch_size': 32}. Best is trial 35 with value: 0.33778827059839334.
[I 2026-06-21 18:39:59,642] Trial 42 finished with value: 0.3379358094749539 and parameters: {'k_features': 81, 'hidden_layer_sizes': (128, 64), 'activation': 'tanh', 'alpha': 0.00014565067598517177, 'learning_rate_init': 0.00016050274332880988, 'batch_size': 32}. Best is trial 35 with value: 0.33778827059839334.
[I 2026-06-21 18:40:01,875] Trial 43 finished with value: 0.33851673078437994 and parameters: {'k_features': 81, 'hidden_layer_sizes': (128, 64), 'activation': 'tanh', 'alpha': 4.44099869762476e-05, 'learning_rate_init': 0.00022996378348870853, 'batch_size': 32}. Best is trial 35 with value: 0.33778827059839334.
[I 2026-06-21 18:40:04,381] Trial 44 finished with value: 0.34771993125419637 and parameters: {'k_features': 89, 'hidden_layer_sizes': (64,), 'activation': 'tanh', 'alpha': 0.000805295358089666, 'learning_rate_init': 0.00016722434325427388, 'batch_size': 32}. Best is trial 35 with value: 0.33778827059839334.
[I 2026-06-21 18:40:05,923] Trial 45 finished with value: 0.36726927672973075 and parameters: {'k_features': 94, 'hidden_layer_sizes': (128,), 'activation': 'relu', 'alpha': 8.235252393352615e-05, 'learning_rate_init': 0.00033549969341339914, 'batch_size': 128}. Best is trial 35 with value: 0.33778827059839334.
[I 2026-06-21 18:40:08,931] Trial 46 finished with value: 0.3420174718857415 and parameters: {'k_features': 83, 'hidden_layer_sizes': (128, 64), 'activation': 'tanh', 'alpha': 0.0003054589956093027, 'learning_rate_init': 0.0001788037971469464, 'batch_size': 16}. Best is trial 35 with value: 0.33778827059839334.
[I 2026-06-21 18:40:12,629] Trial 47 finished with value: 0.3511799355175949 and parameters: {'k_features': 100, 'hidden_layer_sizes': (128, 64, 32), 'activation': 'tanh', 'alpha': 0.00014871194987798008, 'learning_rate_init': 0.00012012333317033007, 'batch_size': 32}. Best is trial 35 with value: 0.33778827059839334.
